,tweet_id,timestamp,text,rating_numerator,name,favorite_count,followers_count,retweet_count,jpg_url,breed,p1_conf,p1_dog,stage,retweet_p,favorite_p
532,790987426131050500,2016-10-25 18:44:32,This is Misty. She has a cowboy hat on her nose. 12/10 https://t.co/Eno0mypHIr,12.0,Misty,11041,3768896,2468,https://pbs.twimg.com/media/Cvom3ZJXEAE29TD.jpg,,0.349195,True,,0.06548336701251507,0.29295050858394606
533,790946055508652032,2016-10-25 16:00:09,This is Betty. She's assisting with the dishes. Such a good puppo. 12/10 h*ckin helpful af https://t.co/dgvTPZ9tgI,12.0,Betty,18527,3768896,5468,https://pbs.twimg.com/media/CvoBPWRWgAA4het.jpg,,0.700466,False,puppo,0.14508227342967275,0.4915763130635602
535,790698755171364864,2016-10-24 23:37:28,This is Mosby. He appears to be rather h*ckin snuggable af. 12/10 keep it up Mosby https://t.co/IiiBq460I7,12.0,Mosby,9118,3768897,2191,https://pbs.twimg.com/media/CvkgUjbUsAEvo7l.jpg,Bernese_mountain_dog,0.996541,True,,0.05813371922872926,0.2419275453799878
536,790581949425475584,2016-10-24 15:53:19,This is Duke. He sneaks into the fridge sometimes. It's his safe place. 11/10 would give little jacket if necessary https://t.co/Fd5WFDTMH4,11.0,Duke,22397,3768897,8143,https://pbs.twimg.com/media/Cvi2FiKWgAAif1u.jpg,,0.998886,False,,0.2160579076583945,0.5942587446672063
537,790337589677002753,2016-10-23 23:42:19,Meet Maggie. She can hear your cells divide. 12/10 can also probably fly https://t.co/ovE2hqXryV,12.0,Maggie,8696,3768897,2160,https://pbs.twimg.com/media/CvfX2AnWYAAQTay.jpg,Pembroke,0.658808,True,,0.05731119741399142,0.2307306355148469
538,790277117346975746,2016-10-23 19:42:02,This is Bruce. He never backs down from a challenge. 11/10 you got this Bruce https://t.co/aI7umZHIq7,11.0,Bruce,14015,3768897,3717,https://pbs.twimg.com/media/Cveg1-NXgAASaaT.jpg,,0.427742,True,,0.09862301888324357,0.3718594591468008
539,789986466051088384,2016-10-23 00:27:05,This is Happy. He's a bathtub reviewer. Seems to be pleased with this one. 12/10 https://t.co/Ln89R4FP7v,12.0,Happy,10311,3768897,2686,https://pbs.twimg.com/media/CvaYgDOWgAEfjls.jpg,,0.479477,False,,0.07126753530276896,0.2735813687665118
540,789628658055020548,2016-10-22 00:45:17,This is Eli. He can fly. 13/10 magical af https://t.co/huPSJJ7FDI,13.0,Eli,8410,3768897,2072,https://pbs.twimg.com/media/CvVTEnPXYAAWLyL.jpg,,0.260702,True,,0.054976296778606576,0.2231422084498462
541,789599242079838210,2016-10-21 22:48:24,This is Brownie. She's wearing a Halloween themed onesie. 12/10 festive af https://t.co/0R4meWXFOx,12.0,Brownie,7579,3768897,2267,https://pbs.twimg.com/media/CvU4UZpXgAE1pAV.jpg,Chesapeake_Bay_retriever,0.8788219999999999,True,,0.060150224322925244,0.20109331722251894
542,789530877013393408,2016-10-21 18:16:44,This is Rizzy. She smiles a lot. 12/10 contagious af https://t.co/TU4sZogVIq,12.0,Rizzy,13117,3768897,3924,https://pbs.twimg.com/media/CvT6IV6WEAQhhV5.jpg,,0.363272,True,,0.10411534196875107,0.3480328594811692
543,789268448748703744,2016-10-21 00:53:56,This is Stella. She's happier than I will ever be. 10/10 would trade lives with https://t.co/JSs2bfDtTS,10.0,Stella,10147,3768898,2996,https://pbs.twimg.com/media/CvQLdotWcAAZn86.jpg,malamute,0.81286,True,,0.07949273235837107,0.26922989160226674
544,789137962068021249,2016-10-20 16:15:26,This is Bo. He's a West Congolese Bugaboop Snuggle. Rather exotic. Master of the head tilt. 12/10 would pay to pet https://t.co/2jwxxtNzoN,12.0,Bo,10824,3768898,3232,https://pbs.twimg.com/media/CvOUw8vWYAAzJDq.jpg,Chihuahua,0.746135,True,,0.08575450967364996,0.28719270195160496
545,788908386943430656,2016-10-20 01:03:11,"This is Lucy. She destroyed not one, but two remotes trying to turn off the debate. 11/10 relatable af https://t.co/3BXh073tDm",11.0,Lucy,30520,3768898,14347,https://pbs.twimg.com/media/CvLD-mbWYAAFI8w.jpg,,0.8815379999999999,False,,0.3806683014504505,0.8097857782301352
546,788765914992902144,2016-10-19 15:37:03,This is Butter. She can have whatever she wants forever. 12/10 would hug softly https://t.co/x5gXRS1abq,12.0,Butter,30604,3768898,11969,https://pbs.twimg.com/media/CvJCabcWgAIoUxW.jpg,cocker_spaniel,0.500509,True,,0.3175729351125979,0.8120145464270988
547,788412144018661376,2016-10-18 16:11:17,This is Dexter. He breaks hearts for a living. 11/10 h*ckin handsome af https://t.co/4DhSsC1W7S,11.0,Dexter,15998,3768899,5964,https://pbs.twimg.com/media/CvEAqQoWgAADj5K.jpg,golden_retriever,0.805238,True,,0.15824249999801002,0.424474097077157
548,788178268662984705,2016-10-18 00:41:57,Atlas is back and this time he's got doggles. Still 13/10 solarly conscious af https://t.co/s7MgFWDySc,13.0,,8060,3768899,2477,https://pbs.twimg.com/media/CvAr88kW8AEKNAO.jpg,Samoyed,0.73548,True,,0.06572211141768458,0.21385555834741127
549,788150585577050112,2016-10-17 22:51:57,This is Leo. He's a golden chow. Rather h*ckin rare. 13/10 would give extra pats https://t.co/xosHjFzVXc,13.0,Leo,6837,3768899,1502,https://pbs.twimg.com/media/CvASw6dWcAQmo3X.jpg,chow,0.814145,True,,0.039852487424046124,0.18140576332769862
551,788039637453406209,2016-10-17 15:31:05,Did... did they pick out that license plate? 12/10 for both https://t.co/lRmUUOxgbQ,12.0,,6838,3768899,1529,https://pbs.twimg.com/media/Cu-t20yWEAAFHXi.jpg,,0.362925,False,,0.04056887701156226,0.1814322962753844
552,787810552592695296,2016-10-17 00:20:47,This is Frank. He wears sunglasses and walks himself. 11/10 I'll never be this cool or independent https://t.co/pNNjBtHWPc,11.0,Frank,9678,3768899,3523,https://pbs.twimg.com/media/Cu7dg2RXYAIaGXE.jpg,,0.362835,True,,0.09347557469701363,0.2567858677030082
553,787717603741622272,2016-10-16 18:11:26,This is Tonks. She is a service puppo. Can hear a caterpillar hiccup from 7 miles away. 13/10 would follow anywhere https://t.co/i622ZbWkUp,13.0,Tonks,11370,3768900,3226,https://pbs.twimg.com/media/Cu6I9vvWIAAZG0a.jpg,German_shepherd,0.992339,True,puppo,0.08559526652338878,0.3016795351428799
554,787397959788929025,2016-10-15 21:01:17,This is Moose. He's rather h*ckin dangerous (you can tell by the collar). 11/10 would still attempt to snug https://t.co/lHVHGdDzb3,11.0,Moose,12064,3768900,3281,https://pbs.twimg.com/media/Cu1mQsDWEAAU_VQ.jpg,Chihuahua,0.900483,True,,0.08705457825890844,0.3200933959510733
555,787322443945877504,2016-10-15 16:01:13,This is Lincoln. He forgot to use his blinker when he changed lanes just now. Guilty as h*ck. Still 10/10 https://t.co/lsrR83SiVp,10.0,Lincoln,8687,3768900,2024,https://pbs.twimg.com/media/Cu0hlfwWYAEdnXO.jpg,,0.747739,False,,0.05370267186712303,0.23049165539016692
556,786963064373534720,2016-10-14 16:13:10,This is Rory. He's got an interview in a few minutes. Looking spiffy af. Nervous as h*ck tho. 12/10 would hire https://t.co/ibj5g6xaAj,12.0,Rory,29595,3768903,9272,https://pbs.twimg.com/media/Cuvau3MW8AAxaRv.jpg,golden_retriever,0.915303,True,,0.24601322984433402,0.7852417533696145
557,786709082849828864,2016-10-13 23:23:56,"This is Logan, the Chow who lived. He solemnly swears he's up to lots of good. H*ckin magical af 9.75/10 https://t.co/yBO5wuqaPS",9.75,Logan,20221,3768903,7033,https://pbs.twimg.com/media/CurzvFTXgAA2_AP.jpg,,0.467321,True,,0.18660602302579823,0.5365221657336365
558,786664955043049472,2016-10-13 20:28:35,"""Honestly Kathleen I just want more Ken Bone"" 12/10 https://t.co/HmlEvAMP4r",12.0,,11908,3768903,2981,https://pbs.twimg.com/media/CurLmoqXgAEPoJ-.jpg,Leonberg,0.512034,True,,0.07909463310676873,0.3159540057146602
559,786595970293370880,2016-10-13 15:54:28,This is Dale. He's a real spookster. Did me quite the frighten. 11/10 not too spooky to pet tho https://t.co/L8BWDD4oBX,11.0,Dale,10460,3768903,3575,https://pbs.twimg.com/media/CuqM0fVWAAAboKR.jpg,Pembroke,0.709512,True,,0.09485518730516546,0.27753433824112744
560,786363235746385920,2016-10-13 00:29:39,This is Rizzo. He has many talents. A true renaissance doggo. 13/10 entertaining af https://t.co/TVXpEJB7Wn,13.0,Rizzo,12129,3768903,4054,https://pbs.twimg.com/media/Cum5LlfWAAAyPcS.jpg,golden_retriever,0.929266,True,doggo,0.10756445575808132,0.3218177809298886
561,786233965241827333,2016-10-12 15:55:59,This is Mattie. She's extremely dangerous. Will bite your h*ckin finger right off. Still 11/10 would pet with caution https://t.co/78c9W8kLFh,11.0,Mattie,17100,3768903,5529,https://pbs.twimg.com/media/CulDnZpWcAAGbZ-.jpg,,0.478193,True,,0.14670051205881393,0.453712923893239
563,785927819176054784,2016-10-11 19:39:28,This is Lucy. She's strives to be the best potato she can be. 12/10 would boop https://t.co/lntsj7Fc4Y,12.0,Lucy,12636,3768903,3627,https://pbs.twimg.com/media/CugtKeXWEAAamDZ.jpg,,0.97207,False,,0.09623489912051332,0.3352699711295303
564,785872687017132033,2016-10-11 16:00:24,Meet Rusty. He appears to be rather h*ckin fluffy. Also downright adorable af. 12/10 would rub my face against his https://t.co/1j9kLGb4wV,12.0,Rusty,7452,3768903,2112,https://pbs.twimg.com/ext_tw_video_thumb/785872596088811520/pu/img/5O-_BgqdFQu_2Bt7.jpg,,0.392108,True,,0.0560375260387439,0.1977233163071589
565,785639753186217984,2016-10-11 00:34:48,This is Pinot. He's a sophisticated doggo. You can tell by the hat. Also pointier than your average pupper. Still 10/10 would pet cautiously https://t.co/f2wmLZTPHd,10.0,Pinot,8680,3768903,2545,https://pbs.twimg.com/media/CucnLmeWAAALOSC.jpg,,0.978042,False,doggopupper,0.06752628019346743,0.2303057414849891
566,785533386513321988,2016-10-10 17:32:08,This is Dallas. Her tongue is ridiculous. 11/10 h*ckin proud af https://t.co/h4jhlH4EyG,11.0,Dallas,10146,3768903,2318,https://pbs.twimg.com/media/CubGchjXEAA6gpw.jpg,,0.436023,True,,0.061503307461083505,0.26920300150998844
567,785264754247995392,2016-10-09 23:44:41,This is Doc. He requested to be carried around like that. 12/10 anything for Doc https://t.co/mWYACm4qnx,12.0,Doc,8095,3768904,1897,https://pbs.twimg.com/media/CuXSHNnWcAIWEwn.jpg,,0.6748930000000001,False,,0.050332934985873885,0.2147839265738793
568,785170936622350336,2016-10-09 17:31:53,This is Hero. He was enjoying the car ride until he remembered that bees are dying globally at an alarming rate. 11/10 https://t.co/cubFg7F4qQ,11.0,Hero,13438,3768904,5608,https://pbs.twimg.com/media/CuV8yfxXEAAUlye.jpg,,0.891193,False,,0.14879657322128662,0.35654927798638547
569,784826020293709826,2016-10-08 18:41:19,This is Rusty. He's going D1 for sure. Insane vertical. 13/10 would draft https://t.co/AsykOwMrXQ,13.0,Rusty,11268,3768904,3698,https://pbs.twimg.com/media/CuRDF-XWcAIZSer.jpg,,0.0903414,True,,0.0981187103730952,0.29897285789184336
570,784517518371221505,2016-10-07 22:15:26,This is Frankie. He has yet to learn how to control his tongue. 11/10 maybe one day https://t.co/p6fgYe2dB6,11.0,Frankie,10005,3768904,2945,https://pbs.twimg.com/media/CuMqhGrXYAQwRqU.jpg,malamute,0.757764,True,,0.07813942727116424,0.2654617894220707
571,784431430411685888,2016-10-07 16:33:21,This is Stormy. He's curly af. Already pupared for Coachella next year. 12/10 https://t.co/PHA1vtqqpt,12.0,Stormy,6308,3768905,1479,https://pbs.twimg.com/media/CuLcNkCXgAEIwK2.jpg,miniature_poodle,0.744819,True,,0.039242167154651016,0.1673695675534406
572,783839966405230592,2016-10-06 01:23:05,This is Riley. His owner put a donut pillow around him and he loves it so much he won't let anyone take it off. 13/10 https://t.co/8TCQcsZCZ8,13.0,Riley,33544,3768906,12544,https://pbs.twimg.com/media/CuDCSM-XEAAJw1W.jpg,,0.333739,False,,0.33282867760565,0.8900195441329658
573,783821107061198850,2016-10-06 00:08:09,This is Mairi. She has mastered the art of camouflage. 12/10 h*ckin sneaky af https://t.co/STcPjiNAHp,12.0,Mairi,8176,3768907,2259,https://pbs.twimg.com/media/CuCxIzyWEAQTnQA.jpg,,0.26565900000000003,True,,0.05993780159605955,0.21693291980937707
574,783695101801398276,2016-10-05 15:47:27,This is Loomis. He's the leader of the Kenneth search party. The passion is almost overwhelming. 12/10 one day he will be free https://t.co/kCRKlFg4AY,12.0,Loomis,11595,3768907,3706,https://pbs.twimg.com/media/CuA-iRHXYAAWP8e.jpg,,0.314265,True,,0.09833089540283164,0.30764887539013297
575,783466772167098368,2016-10-05 00:40:09,This is Finn. He likes eavesdropping from filing cabinets. It's a real issue but no one has approached him about it. 11/10 would still pet https://t.co/s8W8Del9HQ,11.0,Finn,9426,3768908,2586,https://pbs.twimg.com/media/Ct9u3ljW8AEnVIm.jpg,Chihuahua,0.789,True,,0.0686140388674916,0.2500989676585366
576,783391753726550016,2016-10-04 19:42:03,Meet Godi. He's an avid beachgoer and part time rainbow summoner. Eyeliner flawless af. 13/10 would snug well https://t.co/BO936YdJdi,13.0,Godi,18821,3768908,6393,https://pbs.twimg.com/media/Ct8qn8EWIAAk9zP.jpg,Norwegian_elkhound,0.87713,True,,0.16962472949724428,0.4993754159029618
578,783334639985389568,2016-10-04 15:55:06,This is Dave. He's currently in a predicament. Doesn't seem to mind tho. 12/10 someone assist Dave https://t.co/nfprKAXqwu,12.0,Dave,32504,3768909,13512,https://pbs.twimg.com/media/Ct72q9jWcAAhlnw.jpg,Cardigan,0.593858,True,,0.35851223789165515,0.8624246433118975
579,783085703974514689,2016-10-03 23:25:55,This is Earl. He can't catch. Did his best tho. 11/10 would repair confidence with extra pats https://t.co/IsqyvbjFgM,11.0,Earl,9069,3768909,2541,https://pbs.twimg.com/media/Ct4URfWUAAQ7lKe.jpg,,0.240602,True,,0.06742004118433213,0.2406266641088973
580,782969140009107456,2016-10-03 15:42:44,This is Cali. She arrived preassembled. Convenient af. 12/10 appears to be rather h*ckin pettable https://t.co/vOBV1ZqVcX,12.0,Cali,26849,3768910,8471,https://pbs.twimg.com/media/Ct2qO5PXEAE6eB0.jpg,,0.474292,False,,0.22475994385644654,0.7123810332430331
581,782747134529531904,2016-10-03 01:00:34,This is Deacon. He's the happiest almost dry doggo I've ever seen. 11/10 would smile back https://t.co/C6fUMnHt1H,11.0,Deacon,8276,3768910,1593,https://pbs.twimg.com/media/CtzgXgeXYAA1Gxw.jpg,golden_retriever,0.560699,True,doggo,0.04226686230236328,0.21958603415841715
582,782722598790725632,2016-10-02 23:23:04,"This is Penny. She fought a bee and the bee won. 10/10 you're fine Penny, everything's fine https://t.co/zrMVdfFej6",10.0,Penny,19173,3768910,6201,https://pbs.twimg.com/media/CtzKC7zXEAALfSo.jpg,Irish_setter,0.574557,True,,0.16453032839733503,0.5087147212323988
583,782598640137187329,2016-10-02 15:10:30,This is Timmy. He's quite large. According to a trusted source it's actually a dog wearing a dog suit. 11/10 https://t.co/BIUchFwHqn,11.0,Timmy,8664,3768911,2177,https://pbs.twimg.com/media/CtxZTtxUMAEduGo.jpg,malamute,0.8408709999999999,True,,0.05776204320027721,0.22988072682002839
584,782305867769217024,2016-10-01 19:47:08,This is Sampson. He just graduated. Ready to be a doggo now. Time for the real world. 12/10 have fun with taxes https://t.co/pgVKxRw0s1,12.0,Sampson,18547,3768911,6424,https://pbs.twimg.com/media/CttPBt0WIAAcsDE.jpg,briard,0.5044270000000001,True,doggo,0.17044711323774958,0.49210501388862726
586,781955203444699136,2016-09-30 20:33:43,This is Chipson. He weighed in at .3 ounces and is officially super h*ckin smol. Space-saving af. 11/10 would snug delicately https://t.co/FjEsk7A1JV,11.0,Chipson,12317,3768912,3885,https://pbs.twimg.com/media/CtoQGu4XgAQgv5m.jpg,,0.179568,False,,0.10308014620665062,0.3268051894021405
587,781661882474196992,2016-09-30 01:08:10,Who keeps sending in pictures without dogs in them? This needs to stop. 5/10 for the mediocre road https://t.co/ELqelxWMrC,5.0,,11586,3768912,3107,https://pbs.twimg.com/media/CtkFS72WcAAiUrs.jpg,,0.438087,True,,0.08243758410915406,0.3074096715444669
588,781524693396357120,2016-09-29 16:03:01,Idk why this keeps happening. We only rate dogs. Not Bangladeshi Couch Chipmunks. Please only send dogs... 12/10 https://t.co/ya7bviQUUf,12.0,,23074,3768913,6383,https://pbs.twimg.com/media/CtiIj0AWcAEBDvw.jpg,,0.994712,False,,0.16935917597461125,0.6122189607454457
589,781251288990355457,2016-09-28 21:56:36,This is Oakley. He just got yelled at for going 46 in a 45. Churlish af. 11/10 would still pet so well https://t.co/xIYsa6LPA4,11.0,Oakley,9403,3768913,2430,https://pbs.twimg.com/media/CteP5H5WcAEhdLO.jpg,Mexican_hairless,0.8877709999999999,True,,0.06447482337745658,0.24948838033671777
590,781163403222056960,2016-09-28 16:07:23,"We normally don't rate lobsters, but this one appears to be a really good lobster. 10/10 would pet with caution https://t.co/YkHc7U7uUy",10.0,,10852,3768913,3149,https://pbs.twimg.com/media/Ctc_-BTWEAAQpZh.jpg,Shetland_sheepdog,0.973841,True,,0.0835519418994283,0.287934478721053
591,780931614150983680,2016-09-28 00:46:20,I want to finally rate this iconic puppo who thinks the parade is all for him. 13/10 would absolutely attend https://t.co/5dUYOu4b8d,13.0,,24088,3768913,8471,https://pbs.twimg.com/media/CtZtJxAXEAAyPGd.jpg,,0.731564,False,puppo,0.2247597649507962,0.6391232697597423
592,780858289093574656,2016-09-27 19:54:58,"This is Dash. He's very stylish, but also incredibly unimpressed with the current state of our nation. 10/10 would pet ears first https://t.co/YElO4hvXI6",10.0,Dash,8007,3768913,2311,https://pbs.twimg.com/media/CtYqeNHWgAATqYZ.jpg,,0.488555,True,,0.06131741433140006,0.2124485229560884
593,780800785462489090,2016-09-27 16:06:28,This is Koda. He has a weird relationship with tall grass. Slightly concerning. 11/10 would def still pet https://t.co/KQzSR8eCsw,11.0,Koda,6114,3768914,1493,https://pbs.twimg.com/media/CtX2Kr9XYAAuxrM.jpg,Siberian_husky,0.951963,True,,0.039613533235303325,0.16222179651751142
594,780601303617732608,2016-09-27 02:53:48,Meet Hercules. He can have whatever he wants for the rest of eternity. 12/10 would snug passionately https://t.co/mH0IOyFdIG,12.0,Hercules,13464,3768914,3810,https://pbs.twimg.com/media/CtVAvX-WIAAcGTf.jpg,Saint_Bernard,0.995143,True,,0.10109012834997032,0.3572381858540683
595,780543529827336192,2016-09-26 23:04:13,Here's a perturbed super floof. 12/10 would snug so damn well https://t.co/VG095mi09Q,12.0,,7001,3768914,2008,https://pbs.twimg.com/media/CtUMLzRXgAAbZK5.jpg,golden_retriever,0.628312,True,,0.05327794690990561,0.18575642744833126
598,780459368902959104,2016-09-26 17:29:48,"This is Bear. Don't worry, he's not a real bear tho. Contains unreal amounts of squish. 11/10 heteroskedastic af https://t.co/coi4l1T2Sm",11.0,Bear,5868,3768914,1221,https://pbs.twimg.com/media/CtS_p9kXEAE2nh8.jpg,,0.382491,True,,0.03239660018774639,0.15569471736420626
599,780192070812196864,2016-09-25 23:47:39,We only rate dogs. Pls stop sending in non-canines like this Urban Floof Giraffe. I can't handle this. 11/10 https://t.co/zHIqpM5Gni,11.0,,9671,3768914,2571,https://pbs.twimg.com/media/CtPMhwvXYAIt6NG.jpg,,0.144012,True,,0.068215937004665,0.2565991158195703
600,779834332596887552,2016-09-25 00:06:08,This is Scout. He really wants to kiss himself. H*ckin inappropriate. 11/10 narcissistic af https://t.co/x0gV2Ck3AD,11.0,Scout,21161,3768914,8148,https://pbs.twimg.com/media/CtKHLuCWYAA2TTs.jpg,golden_retriever,0.99383,True,,0.21618959732166879,0.5614614713946776
601,779377524342161408,2016-09-23 17:50:56,Have you ever seen such a smol pupper? Portable af. 12/10 would keep in shirt pocket https://t.co/KsqaIzlQ12,12.0,,9791,3768914,3584,https://pbs.twimg.com/ext_tw_video_thumb/779377444025499652/pu/img/eIiLDy9F6rPNarEc.jpg,,0.17092100000000002,False,pupper,0.09509370603839727,0.25978305686996306
602,779123168116150273,2016-09-23 01:00:13,This is Reggie. He hugs everyone he meets. 12/10 keep spreading the love Reggie https://t.co/uMfhduaate,12.0,Reggie,13146,3768914,4189,https://pbs.twimg.com/media/CtAAYizW8AAWzBZ.jpg,,0.43108,True,,0.11114607550079413,0.34880074207052747
603,779056095788752897,2016-09-22 20:33:42,Everybody drop what you're doing and look at this dog. 13/10 must be super h*ckin rare https://t.co/I1bJUzUEW5,13.0,,16444,3768915,5202,https://pbs.twimg.com/media/Cs_DYr1XEAA54Pu.jpg,Chihuahua,0.721188,True,,0.1380238079128874,0.4363059395077894
604,778990705243029504,2016-09-22 16:13:51,This is Jay. He's really h*ckin happy about the start of fall. Sneaky tongue slip in 2nd pic. 11/10 snuggly af https://t.co/vyx1X5eyWI,11.0,Jay,22262,3768915,8371,https://pbs.twimg.com/media/Cs-H5uhWcAAiNY9.jpg,cocker_spaniel,0.7153510000000001,True,,0.22210636217585167,0.5906739738094385
605,778748913645780993,2016-09-22 00:13:04,"This is Mya (pronounced ""mmmyah?""). Her head is round af. 11/10 would pat accordingly https://t.co/1dpEuALnY0",11.0,Mya,7681,3768916,1549,https://pbs.twimg.com/media/Cs6r_-kVIAALh1p.jpg,,0.351434,True,,0.041099350582501706,0.20379865192007465
606,778650543019483137,2016-09-21 17:42:10,"Meet Strider. He thinks he's a sorority girl. Already wants to go to NYC for a weekend to say he's ""studied abroad"" 10/10 https://t.co/KYZkPuiC1l",10.0,Strider,6415,3768916,1714,https://pbs.twimg.com/media/Cs5ShihWEAAH2ti.jpg,German_shepherd,0.515699,True,,0.04547726720362035,0.17020809166349157
607,778624900596654080,2016-09-21 16:00:17,This is Penny. She's a sailor pup. 11/10 would take to the open seas with https://t.co/0rRxyBQt32,11.0,Penny,5166,3768916,1165,https://pbs.twimg.com/media/Cs47N3eWcAEmgiW.jpg,Airedale,0.786089,True,,0.030910744627898314,0.13706858948302375
608,778408200802557953,2016-09-21 01:39:11,RIP Loki. Thank you for the good times. You will be missed by many. 14/10 https://t.co/gJKD9pst5A,14.0,,15089,3768917,4988,https://pbs.twimg.com/media/Cs12ICuWAAECNRy.jpg,Pembroke,0.8483620000000001,True,,0.13234571098275713,0.40035373556913034
610,778383385161035776,2016-09-21 00:00:35,This is Nala. She's a future Dogue model. Won't respond to my texts. 13/10 would be an honor to pet https://t.co/zP1IvAATWv,13.0,Nala,6502,3768917,1264,https://pbs.twimg.com/media/Cs1fjyqWIAE2jop.jpg,,0.345266,True,,0.0335374857021261,0.1725164019266012
611,778286810187399168,2016-09-20 17:36:50,This is Stanley. He has too much skin. Isn't happy about it. Quite pupset actually. Still 11/10 would comfort https://t.co/hhTfnPrWfb,11.0,Stanley,11529,3768919,3804,https://pbs.twimg.com/media/Cs0HuUTWcAUpSE8.jpg,,0.32207,True,,0.10093079739840521,0.30589673060100253
612,778039087836069888,2016-09-20 01:12:28,Evolution of a pupper yawn featuring Max. 12/10 groundbreaking stuff https://t.co/t8Y4x9DmVD,12.0,,9386,3768919,3040,https://pbs.twimg.com/media/CswmaHmWAAAbdY9.jpg,German_shepherd,0.717776,True,pupper,0.08065973293668556,0.24903692544201664
613,778027034220126208,2016-09-20 00:24:34,This is Sophie. She's a Jubilant Bush Pupper. Super h*ckin rare. Appears at random just to smile at the locals. 11.27/10 would smile back https://t.co/QFaUiIHxHq,11.27,Sophie,7292,3768918,1867,https://pbs.twimg.com/media/Cswbc2yWcAAVsCJ.jpg,clumber,0.946718,True,pupper,0.04953676360164907,0.19347727915544993
614,777885040357281792,2016-09-19 15:00:20,This is Wesley. He's clearly trespassing. Seems rather h*ckin violent too. Weaponized forehead. 3/10 wouldn't let in https://t.co/pL7wbMRW7M,3.0,Wesley,7054,3768918,1882,https://pbs.twimg.com/media/CsuaUH2WAAAWJh1.jpg,,0.123529,True,,0.04993475581055359,0.18716246944083156
615,777684233540206592,2016-09-19 01:42:24,"""Yep... just as I suspected. You're not flossing."" 12/10 and 11/10 for the pup not flossing https://t.co/SuXcI9B7pQ",12.0,,12468,3768919,3390,https://pbs.twimg.com/media/CsrjryzWgAAZY00.jpg,,0.253442,True,,0.08994621534715923,0.33081103626795905
617,777621514455814149,2016-09-18 21:33:11,This is Derek. You can't look at him and not smile. Must've just had a blue pupsicle. 12/10 would snug intensely https://t.co/BnVTMtUeI3,12.0,Derek,9706,3768919,2884,https://pbs.twimg.com/media/Csqqoo5WEAAMTVW.jpg,chow,0.999823,True,,0.07652061506230301,0.2575274236458783
618,777189768882946048,2016-09-17 16:57:35,This is Jeffrey. He's being held so he doesn't fly away. 12/10 would set free https://t.co/d3aLyCykn7,12.0,Jeffrey,15858,3768919,4965,https://pbs.twimg.com/media/Cskh9nRWYAAUxBP.jpg,Chihuahua,0.988412,True,,0.13173538619429073,0.4207572516151183
620,776813020089548800,2016-09-16 16:00:31,Meet Solomon. He was arrested for possession of adorable and attempted extra pats on the head. 12/10 would post bail https://t.co/nFqLaOLUQA,12.0,Solomon,5420,3768919,1393,https://pbs.twimg.com/media/CsfLUDbXEAAu0VF.jpg,toy_poodle,0.51661,True,,0.03696019999368519,0.1438078133279065
621,776477788987613185,2016-09-15 17:48:25,This is Huck. He's addicted to caffeine. Hope it's not too latte to seek help. 11/10 stay strong pupper https://t.co/iJE3F0VozW,11.0,Huck,9823,3768920,3223,https://pbs.twimg.com/media/CsaaaaxWgAEfzM7.jpg,Labrador_retriever,0.8848389999999999,True,pupper,0.08551521390743236,0.2606316928987614
622,776218204058357768,2016-09-15 00:36:55,Atlas rolled around in some chalk and now he's a magical rainbow floofer. 13/10 please never take a bath https://t.co/nzqTNw0744,13.0,,33209,3768920,18343,https://pbs.twimg.com/media/CsWuVEdWcAAqbe9.jpg,Samoyed,0.940326,True,floofer,0.486691147596659,0.8811277501247041
623,776201521193218049,2016-09-14 23:30:38,This is O'Malley. That is how he sleeps. Doesn't care what you think about it. 10/10 comfy af https://t.co/Pq150LeRaC,10.0,,10635,3768920,2890,https://pbs.twimg.com/media/CsWfKadWEAAtmlS.jpg,Rottweiler,0.502228,True,,0.0766797915583244,0.28217632637466433
624,776113305656188928,2016-09-14 17:40:06,This is Sampson. He's about to get hit with a vicious draw 2. Has no idea. 11/10 poor pupper https://t.co/FYT9QBEnKG,11.0,Sampson,13050,3768920,5024,https://pbs.twimg.com/media/CsVO7ljW8AAckRD.jpg,,0.777468,False,pupper,0.13330078643218746,0.3462530380055825
625,776088319444877312,2016-09-14 16:00:49,I can't tap the screen to make the hearts appear fast enough. 10/10 for the source of all future unproductiveness https://t.co/wOhuABgj6I,10.0,,2037,3768920,177,https://pbs.twimg.com/media/CsU4NKkW8AUI5eG.jpg,,0.999916,False,,0.0046963055729492805,0.054047313288687476
