,tweet_id,timestamp,text,rating_numerator,name,favorite_count,followers_count,retweet_count,jpg_url,breed,p1_conf,p1_dog,stage,retweet_p,favorite_p
1496,678675843183484930,2015-12-20 20:38:24,Exotic pup here. Tail long af. Throat looks swollen. Might breathe fire. Exceptionally unfluffy 2/10 would still pet https://t.co/a8SqCaSo2r,2.0,,3136,3768915,1674,https://pbs.twimg.com/media/CWskEqnWUAAQZW_.jpg,,0.33985,False,,0.044415965868160996,0.08320697070642347
1497,678643457146150913,2015-12-20 18:29:43,Meet Grizz. He just arrived. Couldn't wait until Christmas. Worried bc he saw the swastikas on the carpet. 10/10 https://t.co/QBGwYrT7rv,10.0,Grizz,2239,3768915,486,https://pbs.twimg.com/media/CWsGnyMVEAAM1Y1.jpg,,0.33875700000000003,True,,0.012894957832691902,0.0594070176695415
1498,678446151570427904,2015-12-20 05:25:42,Touching scene here. Really stirs up the emotions. The bond between father &amp; son. So beautiful. 10/10 for both pups https://t.co/AJWJHov5gx,10.0,,4340,3768915,1777,https://pbs.twimg.com/media/CWpTLOYWsAEDhcU.jpg,,0.284492,True,,0.04714884787797018,0.11515250410263964
1499,678424312106393600,2015-12-20 03:58:55,This is Crystal. She's a shitty fireman. No sense of urgency. People could be dying Crystal. 2/10 just irresponsible https://t.co/rtMtjSl9pz,2.0,Crystal,5887,3768915,2866,https://pbs.twimg.com/media/CWo_T8gW4AAgJNo.jpg,Maltese_dog,0.759945,True,,0.07604310524381686,0.15619879991987082
1500,678410210315247616,2015-12-20 03:02:53,Say hello to Jerome. He can shoot french fries out of his mouth at insane speeds. Deadly af. 10/10 https://t.co/dIy88HwrX8,10.0,Jerome,4616,3768915,2060,https://pbs.twimg.com/media/CWoyfMiWUAAmGdd.jpg,,0.145877,True,,0.054657640196183785,0.12247556657552637
1501,678399652199309312,2015-12-20 02:20:55,This made my day. 12/10 please enjoy https://t.co/VRTbo3aAcm,12.0,,62146,3768915,30797,https://pbs.twimg.com/ext_tw_video_thumb/678399528077250560/pu/img/BOjUNHRsYLeSo0hl.jpg,,0.929196,False,,0.8171317209329475,1.6489095668116687
1502,678396796259975168,2015-12-20 02:09:34,These little fellas have opposite facial expressions. Both 12/10 https://t.co/LmThv0GWen,12.0,,1722,3768915,472,https://pbs.twimg.com/media/CWomSU_XIAAUYiK.jpg,Pembroke,0.95618,True,,0.012523498142038224,0.045689541950402174
1503,678389028614488064,2015-12-20 01:38:42,"This is Bella. She just learned that her final grade in chem was a 92.49 
poor pupper 11/10 https://t.co/auOoKuoveM",11.0,Bella,2035,3768915,469,https://pbs.twimg.com/media/CWofOHUWUAACGVa.jpg,miniature_pinscher,0.516284,True,pupper,0.012443899636898154,0.053994319320016505
1504,678380236862578688,2015-12-20 01:03:46,This is Crumpet. He underestimated the snow. Quickly retreating. 10/10 https://t.co/a0Zx5LDFZa,10.0,Crumpet,2641,3768915,1017,https://pbs.twimg.com/media/CWoXOfSUAAA4u8g.jpg,,0.08854,False,,0.02698389324248491,0.07007321735831135
1505,678341075375947776,2015-12-19 22:28:09,This pupper likes tape. 12/10 https://t.co/cSp6w5GWgm,12.0,,1886,3768916,610,https://pbs.twimg.com/media/CWnznDTU4AAa-6P.jpg,golden_retriever,0.853284,True,pupper,0.016185025084135597,0.050040913620786456
1506,678334497360859136,2015-12-19 22:02:01,This is Rosie. She has a snazzy bow tie and a fin for a tail. Probably super fast underwater. Cool socks 10/10 https://t.co/GO76MdGBs0,10.0,Rosie,1423,3768916,302,https://pbs.twimg.com/media/CWntoDVWcAEl3NB.jpg,,0.378643,True,,0.008012914058047459,0.03775621425364747
1507,678278586130948096,2015-12-19 18:19:51,Another spooky pupper here. Most definitely floating. No legs. Probably knows some dark magic. 10/10 very spooked https://t.co/JK8MByRzgj,10.0,,12477,3768916,6810,https://pbs.twimg.com/media/CWm6xySUEAAqfFU.jpg,Maltese_dog,0.897841,True,pupper,0.18068855872616954,0.3310500950405899
1508,678255464182861824,2015-12-19 16:47:58,This is Jessifer. She is a Bismoth Teriyaki. Flowers being attacked by hurricanes on bandana (rad). 9/10 stellar pup https://t.co/nZhmRwZzWv,9.0,Jessifer,1719,3768918,417,https://pbs.twimg.com/media/CWmlvxJU4AEAqaN.jpg,Chihuahua,0.613819,True,,0.011064183407545614,0.04560990714045782
1509,678021115718029313,2015-12-19 01:16:45,This is Reese. He likes holding hands. 12/10 https://t.co/cbLroGCbmh,12.0,Reese,14950,3768918,7114,https://pbs.twimg.com/media/CWjQm5gXAAA9GkD.jpg,miniature_pinscher,0.822048,True,,0.18875443827644964,0.39666556820817006
1510,677918531514703872,2015-12-18 18:29:07,"""Everything looks pretty good in there. Make sure to brush your gums. Been flossing? How's school going?"" Both 10/10 https://t.co/lWL2IMJqLR",10.0,,1470,3768918,461,https://pbs.twimg.com/media/CWhzTbzWUAAEAUN.jpg,,0.199347,True,,0.0122316272203322,0.03900323647264281
1511,677895101218201600,2015-12-18 16:56:01,Guys this was terrifying. Really spooked me up. We don't rate ghosts. We rate dogs. Please only send dogs... 9/10 https://t.co/EJImi1udYb,9.0,,5256,3768918,2371,https://pbs.twimg.com/media/CWhd_7WWsAAaqWG.jpg,dalmatian,0.550702,True,,0.0629093018208409,0.13945647000014327
1512,677716515794329600,2015-12-18 05:06:23,IT'S PUPPERGEDDON. Total of 144/120 ...I think https://t.co/ZanVtAtvIq,12.0,,3310,3768918,1101,https://pbs.twimg.com/media/CWe7kw9W4AE8UJh.jpg,,0.6629079999999999,False,,0.029212628133591656,0.08782361409826375
1513,677700003327029250,2015-12-18 04:00:46,This is Ralph. He's an interpretive dancer. 10/10 https://t.co/zoDdPyPFsa,10.0,Ralph,3675,3768918,1613,https://pbs.twimg.com/media/CWesj06W4AAIKl8.jpg,,0.120849,True,,0.042797428864199225,0.09750809118160703
1514,677698403548192770,2015-12-18 03:54:25,This is Sadie. She got her holidays confused. 9/10 damn it Sadie https://t.co/fm7HxOsuPK,9.0,Sadie,1325,3768918,361,https://pbs.twimg.com/media/CWerGmOXAAAm6NY.jpg,Shih-Tzu,0.916645,True,,0.009578345827635412,0.03515597845323247
1515,677687604918272002,2015-12-18 03:11:30,This was Cindy's face when she heard Susan forgot the snacks for after the kid's soccer game. 11/10 https://t.co/gzkuVGRgAD,11.0,,2670,3768918,948,https://pbs.twimg.com/media/CWehRdEWIAAySyO.jpg,Pembroke,0.573047,True,,0.025153107602765568,0.07084261318500429
1516,677673981332312066,2015-12-18 02:17:22,Endangered triangular pup here. Could be a wizard. Caught mid-laugh. No legs. Just fluff. Probably a wizard. 9/10 https://t.co/GFVIHIod0Z,9.0,,3596,3768918,1669,https://pbs.twimg.com/media/CWeU5LBWEAA8F0J.jpg,Maltese_dog,0.817908,True,,0.044283266444109425,0.09541199888137657
1517,677662372920729601,2015-12-18 01:31:14,"In honor of the new Star Wars movie. Here's Yoda pug. 12/10 pet really well, would I https://t.co/pvjdRn00XH",12.0,,2123,3768918,1097,https://pbs.twimg.com/media/CWeKTZTWsAA5R3Z.jpg,,0.25611,False,,0.029106496877883786,0.056329163966952846
1518,677644091929329666,2015-12-18 00:18:36,This is a dog swinging. I really enjoyed it so I hope you all do as well. 11/10 https://t.co/Ozo9KHTRND,11.0,,2031,3768919,885,https://pbs.twimg.com/ext_tw_video_thumb/677644010865999872/pu/img/zVHEMYnJKzq1SauT.jpg,Chihuahua,0.626236,True,,0.023481534095054844,0.05388813078763433
1519,677573743309385728,2015-12-17 19:39:03,This is Sandy. He's sexually confused. Thinks he's a pigeon. Also an All-American cheese catcher. 10/10 so petable https://t.co/Htu8plSqEu,10.0,Sandy,2312,3768919,816,https://pbs.twimg.com/media/CWc5uVPXIAErLYr.jpg,,0.5350699999999999,False,,0.021650770419847174,0.06134384952290033
1520,677565715327688705,2015-12-17 19:07:09,Contortionist pup here. Inside pentagram. Clearly worships Satan. Known to slowly push fragile stuff off tables 6/10 https://t.co/EX9oR55VMe,6.0,,1403,3768919,512,https://pbs.twimg.com/media/CWcybBmWcAAigAQ.jpg,,0.397295,True,,0.013584797126178619,0.03722552806255587
1521,677557565589463040,2015-12-17 18:34:46,Reckless pupper here. Not even looking at road. Absolute menace. No regard for fellow pupper lives. 10/10 still cute https://t.co/96IBkOYB7j,10.0,,2653,3768919,1314,https://pbs.twimg.com/media/CWcrAVQWEAA6QMp.jpg,,0.27725700000000003,False,pupper,0.034864108249606854,0.07039153667139039
1522,677547928504967168,2015-12-17 17:56:29,Not much to say here. I just think everyone needs to see this. 12/10 https://t.co/AGag0hFHpe,12.0,,7535,3768919,4057,https://pbs.twimg.com/media/CWciPonWEAUOqLD.jpg,American_Staffordshire_terrier,0.914978,True,,0.10764359754083333,0.1999246998940545
1523,677530072887205888,2015-12-17 16:45:31,Say hello to Axel. He's a Black Chevy Pinot on wheels. 0 to 60 in 5.7 seconds (if downhill). 9/10 I call shotgun https://t.co/DKe9DBnnHE,9.0,Axel,1156,3768920,249,https://pbs.twimg.com/media/CWcSAI-WUAAOB9W.jpg,Staffordshire_bullterrier,0.6892590000000001,True,,0.006606667161945598,0.03067191662332976
1524,677334615166730240,2015-12-17 03:48:51,This dog gave up mid jump. 9/10 https://t.co/KmMv3Y2zI8,9.0,,1470,3768920,327,https://pbs.twimg.com/media/CWZgPPUWUAAUOvu.jpg,Lakeland_terrier,0.859392,True,,0.008676225550024941,0.03900321577534148
1525,677331501395156992,2015-12-17 03:36:28,Meet Humphrey. He's a Northern Polyp Viagra. One ear works. Face stuck like that. Always surprised. 9/10 petable af https://t.co/FS7eJQM2F4,9.0,Humphrey,1179,3768920,264,https://pbs.twimg.com/media/CWZdaGxXAAAjGjb.jpg,,0.313464,True,,0.007004659159653164,0.031282171019814696
1526,677328882937298944,2015-12-17 03:26:04,This is Derek. All the dogs adore Derek. He's a great guy. 10/10 really solid pup https://t.co/KgcsGNb61s,10.0,Derek,3925,3768920,1681,https://pbs.twimg.com/media/CWZbBlAUsAAjRg5.jpg,,0.42425,False,,0.044601636543094576,0.10414123940014645
1527,677314812125323265,2015-12-17 02:30:09,"Meet Tassy &amp; Bee. Tassy is pretty chill, but Bee is convinced the Ruffles are haunted. 10/10 &amp; 11/10 respectively https://t.co/fgORpmTN9C",10.0,Tassy,1783,3768920,609,https://pbs.twimg.com/media/CWZOOIUW4AAQrX_.jpg,Blenheim_spaniel,0.924127,True,,0.016158475106927184,0.047307982127506025
1528,677301033169788928,2015-12-17 01:35:24,This is Juckson. He's totally on his way to a nascar race. 5/10 for Juckson https://t.co/IoLRvF0Kak,5.0,Juckson,1355,3768920,468,https://pbs.twimg.com/media/CWZBsjPWsAAZFFl.jpg,Japanese_spaniel,0.6611779999999999,True,,0.012417350328476061,0.0359519437929168
1529,677269281705472000,2015-12-16 23:29:14,This is the happiest pupper I've ever seen. 10/10 would trade lives with https://t.co/ep8ATEJwRb,10.0,,2144,3768920,788,https://pbs.twimg.com/media/CWYk0WxWoAAEwRt.jpg,Shetland_sheepdog,0.656616,True,pupper,0.020907846279570805,0.056886322872334784
1530,677228873407442944,2015-12-16 20:48:40,Say hello to Chuq. He just wants to fit in. 11/10 https://t.co/hGkMCjZzn4,11.0,Chuq,3826,3768921,1829,https://pbs.twimg.com/media/CWYAEINW4AIuw8P.jpg,,0.566338,False,,0.04852847804451194,0.10151446528064664
1531,677187300187611136,2015-12-16 18:03:28,Here we see a Byzantine Rigatoni. Very aerodynamic. No eyes. Actually not windy here they just look like that. 9/10 https://t.co/gzI0m6wXRo,9.0,,2964,3768921,1031,https://pbs.twimg.com/media/CWXaQMBWcAAATDi.jpg,,0.282396,True,,0.027355309384303892,0.07864319788077277
1532,676975532580409345,2015-12-16 04:01:59,This is Cooper. He doesn't know how cheese works. Likes the way it feels on his face. Cheeky tongue slip. 11/10 https://t.co/j1zczS0lI5,11.0,Cooper,3000,3768922,1196,https://pbs.twimg.com/media/CWUZpydWcAAeipD.jpg,,0.363257,True,,0.03173321177779747,0.07959835730216756
1533,676957860086095872,2015-12-16 02:51:45,10/10 I'd follow this dog into battle no questions asked https://t.co/ngTNXYQF0L,0.0,,2381,3768922,902,https://pbs.twimg.com/ext_tw_video_thumb/676957802976419840/pu/img/dCj-qlXo73A5hf6Q.jpg,Labrador_retriever,0.772423,True,,0.02393257276218505,0.06317456291215366
1534,676949632774234114,2015-12-16 02:19:04,This is Tyrus. He's a Speckled Centennial Ticonderoga. Terrified of floating red ball. Nifty bandana. 8/10 v petable https://t.co/HqM3YhCaaa,8.0,Tyrus,1407,3768922,444,https://pbs.twimg.com/media/CWUCGMtWEAAjXnS.jpg,,0.206479,True,,0.0117805568807208,0.03733162957471659
1535,676948236477857792,2015-12-16 02:13:31,This is Karl. Karl thinks he's slick. 6/10 sneaky pup https://t.co/Lo4ALwjVh4,6.0,Karl,2341,3768923,977,https://pbs.twimg.com/media/CWUA1GFW4AAowiq.jpg,,0.611603,False,,0.025922524816771264,0.062113235001086516
1536,676946864479084545,2015-12-16 02:08:04,This pups goal was to get all four feet as close to each other as possible. Valiant effort 12/10 https://t.co/2mXALbgBTV,12.0,,1829,3768924,424,https://pbs.twimg.com/media/CWT_lOQWUAAXPaY.jpg,Pekinese,0.752707,True,,0.011249895195551834,0.048528439416661094
1537,676942428000112642,2015-12-16 01:50:26,Who leaves the last cupcake just sitting there? 9/10 https://t.co/PWMqAoEx2a,9.0,,2247,3768924,852,https://pbs.twimg.com/media/CWT7imQXIAMwpQ2.jpg,,0.707199,False,,0.022605921477854157,0.05961913798208719
1538,676936541936185344,2015-12-16 01:27:03,Here we see a rare pouched pupper. Ample storage space. Looks alert. Jumps at random. Kicked open that door. 8/10 https://t.co/mqvaxleHRz,8.0,,13731,3768924,5486,https://pbs.twimg.com/media/CWT2MUgWIAECWig.jpg,Chesapeake_Bay_retriever,0.5452859999999999,True,pupper,0.14555878547829565,0.3643214880427411
1539,676897532954456065,2015-12-15 22:52:02,Exotic handheld dog here. Appears unathletic. Feet look deadly. Can be thrown a great distance. 5/10 might pet idk https://t.co/Avq4awulqk,5.0,,2419,3768925,813,https://pbs.twimg.com/media/CWTSt0UW4AALMNB.jpg,,0.628255,False,,0.021571137658616183,0.06418275768289367
1540,676864501615042560,2015-12-15 20:40:47,Meet Ash. He's just a head now. Lost his body during the Third Crusade. Still in good spirits. 10/10 would pet well https://t.co/NJj2uP0atK,10.0,Ash,2278,3768926,802,https://pbs.twimg.com/media/CWS0q8iU8AE2Srr.jpg,,0.371146,True,,0.021279271601511943,0.06044162183072843
1541,676821958043033607,2015-12-15 17:51:44,Finally some constructive political change in this country. 11/10 https://t.co/mvQaETHVSb,11.0,,25013,3768926,17503,https://pbs.twimg.com/media/CWSN-vaXAAA8Ehr.jpg,Great_Pyrenees,0.8698040000000001,True,,0.464402856410553,0.6636638660456586
1542,676819651066732545,2015-12-15 17:42:34,Watch out Airbud. This pupper is also good at the sports. 12/10 I'm thinking D1 https://t.co/1HrFdo7M0C,12.0,,1949,3768926,738,https://pbs.twimg.com/media/CWSL4W8WsAAE4KU.jpg,,0.625555,False,pupper,0.019581175114608246,0.05171234457773912
1543,676811746707918848,2015-12-15 17:11:09,Say hello to Penny &amp; Gizmo. They are practicing their caroling. The ambition in the room is tangible. 9/10 for both https://t.co/aqBHjjh5VD,9.0,Penny,1526,3768926,468,https://pbs.twimg.com/media/CWSEsO9WwAAX-fZ.jpg,,0.440916,True,,0.012417330560483277,0.040488988109610005
1544,676776431406465024,2015-12-15 14:50:49,"When someone yells ""cops!"" at a party and you gotta get your drunk friend out of there. 10/10 https://t.co/4rMZi5Ca1k",10.0,,5377,3768926,2233,https://pbs.twimg.com/ext_tw_video_thumb/676776408941662209/pu/img/k-6I3YEZAQtYPBXR.jpg,,0.201346,False,,0.05924764773837428,0.14266663765751833
1545,676617503762681856,2015-12-15 04:19:18,I promise this wasn't meant to be a cuteness overload account but ermergerd look at this cozy pupper. 13/10 https://t.co/mpQl2rJjDh,13.0,,3123,3768926,1103,https://pbs.twimg.com/media/CWPUB9TWwAALPPx.jpg,Chihuahua,0.841084,True,pupper,0.029265631641480886,0.0828618020093788
1546,676613908052996102,2015-12-15 04:05:01,This is the saddest/sweetest/best picture I've been sent. 12/10 ðŸ˜¢ðŸ¶ https://t.co/vQ2Lw1BLBF,12.0,,1172,3768926,219,https://pbs.twimg.com/media/CWPQwmJWUAAu_At.jpg,,0.49379,False,,0.0058106739161235856,0.031096391916423938
1547,676606785097199616,2015-12-15 03:36:42,*screeches for a sec and then faints* 12/10 https://t.co/N5QL4ySBEx,12.0,,2029,3768926,488,https://pbs.twimg.com/media/CWPKSGpWcAQN6mw.jpg,,0.202999,False,,0.012947985712640683,0.05383496518636874
1548,676603393314578432,2015-12-15 03:23:14,This is Godzilla pupper. He had a ruff childhood &amp; now deflects that pain outward by terrorizing cities. Tragic 9/10 https://t.co/g1tLGkyaxr,9.0,Godzilla,1268,3768927,440,https://pbs.twimg.com/media/CWPHMqKVAAAE78E.jpg,whippet,0.8770209999999999,True,pupper,0.011674410249919937,0.033643527720223824
1549,676588346097852417,2015-12-15 02:23:26,This is Bubbles. He kinda resembles a fish. Always makes eye contact with u no matter what. Sneaky tongue slip. 5/10 https://t.co/Nrhvc5tLFT,5.0,Bubbles,2519,3768927,893,https://pbs.twimg.com/media/CWO5gmCUYAAX4WA.jpg,Boston_bull,0.976577,True,,0.023693746257223872,0.06683599868079164
1550,676582956622721024,2015-12-15 02:02:01,"Meet Vinnie. He's having fun while being safe. Well not a lot of fun, but definitely safe, and that's important 8/10 https://t.co/vZYtynZZlH",8.0,Vinnie,1299,3768927,311,https://pbs.twimg.com/media/CWO0m8tUwAAB901.jpg,,0.790028,False,,0.008251685426647956,0.03446604298783182
1551,676575501977128964,2015-12-15 01:32:24,This pupper is very passionate about Christmas. Wanted to give the tree a hug. So cute. 8/10 https://t.co/NsGyECJuq7,8.0,,2794,3769085,1252,https://pbs.twimg.com/media/CWOt07EUsAAnOYW.jpg,,0.424106,False,pupper,0.033217611170881,0.07412939745322804
1552,676533798876651520,2015-12-14 22:46:41,ITSOFLUFFAYYYYY 12/10 https://t.co/bfw13CnuuZ,12.0,,2018,3768929,618,https://pbs.twimg.com/media/CWOH4s9U8AEtkmQ.jpg,,0.26527399999999995,True,,0.01639723114975103,0.05354306223332942
1553,676496375194980353,2015-12-14 20:17:59,Say hello to Griffin. He's upset because his costume for Halloween didn't arrive until today. 9/10 cheer up pup https://t.co/eoBCjSFajX,9.0,Griffin,1631,3768929,601,https://pbs.twimg.com/media/CWNl3S9WcAARN34.jpg,pug,0.985387,True,,0.015946174629450433,0.04327489321236882
1554,676470639084101634,2015-12-14 18:35:43,Three generations of pupper. 11/10 for all https://t.co/tAmQYvzrau,11.0,,12568,3768929,5197,https://pbs.twimg.com/media/CWNOdIpWoAAWid2.jpg,golden_retriever,0.7903859999999999,True,pupper,0.13789063152954062,0.3334634321845808
1555,676440007570247681,2015-12-14 16:34:00,Hope your Monday isn't too awful. Here's two baseball puppers. 11/10 for each https://t.co/dB0H9hdZai,11.0,,1853,3768929,740,https://pbs.twimg.com/media/CWMyl9EWUAAnZJ0.jpg,Maltese_dog,0.579472,True,,0.019634225001320005,0.049165160712764826
1556,676430933382295552,2015-12-14 15:57:56,"Meet Duke. He's an Urban Parmesan. They know he's scared of the green rubber dog. ""Why u do dis?"" thinks Duke. 10/10 https://t.co/3bim9U5Idr",10.0,Duke,1519,3768929,385,https://pbs.twimg.com/media/CWMqV7WUYAEEClG.jpg,golden_retriever,0.583875,True,,0.010215103547984055,0.04030322672568255
1557,676263575653122048,2015-12-14 04:52:55,All this pupper wanted to do was go skiing. No one told him about the El NiÃ±o. Poor pupper. 10/10 maybe next year https://t.co/fTgbq1UBR9,10.0,,2233,3768929,605,https://pbs.twimg.com/media/CWKSIfUUYAAiOBO.jpg,,0.0982826,False,pupper,0.016052305575403516,0.05924760057830753
1558,676237365392908289,2015-12-14 03:08:46,Say hello to Winston. He has no respect for the system. Much rebellion. I think that's a palm tree... nice. 8/10 https://t.co/dOLQddhXLZ,8.0,Winston,1325,3768930,331,https://pbs.twimg.com/media/CWJ6Sc-WwAAlpI6.jpg,French_bulldog,0.961996,True,,0.00878233344742407,0.03515586651914469
1559,676219687039057920,2015-12-14 01:58:31,This is Kenneth. He's stuck in a bubble. 10/10 hang in there Kenneth https://t.co/uQt37xlYMJ,10.0,Kenneth,66833,3768930,31810,https://pbs.twimg.com/media/CWJqN9iWwAAg86R.jpg,,0.997556,False,,0.8440061237539567,1.7732619072256581
1560,676215927814406144,2015-12-14 01:43:35,This is Herm. He just wants to be like the other dogs. Sneaky tongue slip. Super fuzzy. 9/10 would cuddle firmly https://t.co/tg8h9lzCHv,9.0,Herm,1873,3768930,655,https://pbs.twimg.com/media/CWJmzNsWUAE706Z.jpg,,0.999484,False,,0.01737893778870926,0.049695802256873964
1561,676191832485810177,2015-12-14 00:07:50,These two pups just met and have instantly bonded. Spectacular scene. Mesmerizing af. 10/10 and 7/10 for blue dog https://t.co/gwryaJO4tC,10.0,,2464,3768931,1142,https://pbs.twimg.com/media/CWJQ4UmWoAIJ29t.jpg,,0.376741,True,,0.030300368990570536,0.06537662801468108
1562,676146341966438401,2015-12-13 21:07:04,This is Bert. He likes flowers. 10/10 https://t.co/lmQRrNxaQu,10.0,Bert,2068,3768931,739,https://pbs.twimg.com/media/CWIngp5WEAAJOy3.jpg,,0.388332,True,,0.019607681859922614,0.054869669940893054
1563,676101918813499392,2015-12-13 18:10:33,Meet Striker. He's ready for Christmas. 11/10 https://t.co/B3xxSLjQSH,11.0,Striker,3027,3768932,1280,https://pbs.twimg.com/media/CWH_FTgWIAAwOUy.jpg,,0.225848,True,,0.03396187567194101,0.08031452942106676
1564,676098748976615425,2015-12-13 17:57:57,Extremely rare pup here. Very religious. Always praying. Too many legs. Not overwhelmingly fluffy. Won't bark. 3/10 https://t.co/REyE5YKVBb,3.0,,3259,3768932,1610,https://pbs.twimg.com/media/CWH8L72UkAAvjql.jpg,,0.162179,False,,0.04271767174361331,0.08647011938660608
1565,676089483918516224,2015-12-13 17:21:08,"""Yes hello I'ma just snag this here toasted bagel real quick. carry on."" 9/10 https://t.co/Cuz0Osnekp",9.0,,1422,3768932,479,https://pbs.twimg.com/media/CWHzzFGXIAA0Y_H.jpg,bull_mastiff,0.743808,True,,0.012709170661609178,0.037729521254296974
1566,675898130735476737,2015-12-13 04:40:46,I'm sure you've all seen this pupper. Not prepared at all for the flying disc of terror. 10/10 https://t.co/G0pQiFGM7O,10.0,,1766,3768932,651,https://pbs.twimg.com/media/CWFFt3_XIAArIYK.jpg,,0.40743,True,pupper,0.017272797705026252,0.04685677534113113
1567,675891555769696257,2015-12-13 04:14:39,This is Donny. He's summoning the demon monster Babadook. 6/10 Donny please no that won't be a good time for anyone https://t.co/kiW6Knb7Gp,6.0,Donny,2286,3768932,971,https://pbs.twimg.com/media/CWE_x33UwAEE3no.jpg,,0.305637,True,,0.025763266623011507,0.06065378733285715
1568,675888385639251968,2015-12-13 04:02:03,Breathtaking scene. A father taking care of his newborn pup. Tugs at the heartstrings. 10/10 restores my faith https://t.co/06oZdehGEa,10.0,,2571,3768932,1063,https://pbs.twimg.com/media/CWE85snWIAEG5ES.jpg,West_Highland_white_terrier,0.672117,True,,0.028204276436932265,0.06821561121293777
1569,675878199931371520,2015-12-13 03:21:34,"Ok, I'll admit this is a pretty adorable bunny hopping towards the ocean but please only send in dogs... 11/10 https://t.co/sfsVCGIipI",11.0,,4506,3768932,1562,https://pbs.twimg.com/media/CWEzo19WoAEiOCj.jpg,,0.785756,False,,0.04144410140591553,0.11955641545137985
1571,675853064436391936,2015-12-13 01:41:41,Here we have an entire platoon of puppers. Total score: 88/80 would pet all at once https://t.co/y93p6FLvVw,11.0,,2903,3768935,1447,https://pbs.twimg.com/media/CWEcxqWVEAAHyGH.jpg,Labrador_retriever,0.868367,True,,0.0383928085785507,0.07702441140534395
1572,675845657354215424,2015-12-13 01:12:15,"This is Pepper. She's not fully comfortable riding her imaginary bike yet. 10/10 don't worry pupper, it gets easier https://t.co/40dj4eTsXG",10.0,Pepper,2460,3768934,991,https://pbs.twimg.com/media/CWEWClfW4AAnqhG.jpg,pug,0.8839520000000001,True,pupper,0.02629390697741059,0.06527044517096878
1573,675822767435051008,2015-12-12 23:41:18,ðŸŽ¶ HELLO FROM THE OTHER SIIIIIIIIDE ðŸŽ¶ 10/10s https://t.co/GK2HJtkdQk,10.0,,1644,3768934,589,https://pbs.twimg.com/media/CWEBOFYWwAA-O2c.jpg,,0.4607100000000001,True,,0.015627761059227887,0.04361976091913523
1574,675820929667219457,2015-12-12 23:34:00,Here's a handful of sleepy puppers. All look unaware of their surroundings. Lousy guard dogs. Still cute tho 11/10s https://t.co/lyXX3v5j4s,11.0,,1130,3768934,259,https://pbs.twimg.com/media/CWD_jQMWEAAdYwH.jpg,basset,0.556373,True,,0.006871969633854029,0.02998195245658321
1575,675798442703122432,2015-12-12 22:04:39,This is Bernie. He just touched a boob for the first time. 10/10 https://t.co/whQKMygnK6,10.0,Bernie,11049,3769092,3769,https://pbs.twimg.com/media/CWDrGH4UYAARoq_.jpg,beagle,0.681218,True,,0.09999755909380827,0.2931475273089646
1576,675781562965868544,2015-12-12 20:57:34,Say hello to Buddah. He was Waldo for Halloween. 11/10 https://t.co/DVAqAnb624,11.0,Buddah,1741,3768936,531,https://pbs.twimg.com/media/CWDbv2yU4AARfeH.jpg,Maltese_dog,0.921968,True,,0.014088856908156573,0.04619340843145121
1577,675740360753160193,2015-12-12 18:13:51,Here's a pupper licking in slow motion. 12/10 please enjoy https://t.co/AUJi8ujxw9,12.0,,1250,3768936,387,https://pbs.twimg.com/ext_tw_video_thumb/675740268751138818/pu/img/dVaVeFAVT-lk_1ZV.jpg,golden_retriever,0.800495,True,pupper,0.010268149950012417,0.03316585901166801
1578,675710890956750848,2015-12-12 16:16:45,This is Lenny. He was just told that he couldn't explore the fish tank. 12/10 smh all that work for nothing https://t.co/JWi6YrpiO1,12.0,Lenny,2039,3768936,922,https://pbs.twimg.com/media/CWCbd8ZWoAAtqoH.jpg,,0.4414270000000001,True,,0.024463137607006327,0.05410014921983287
1580,675706639471788032,2015-12-12 15:59:51,This is a Sizzlin Menorah spaniel from Brooklyn named Wylie. Lovable eyes. Chiller as hell. 10/10 and I'm out.. poof https://t.co/7E0AiJXPmI,10.0,,689,3768937,106,https://pbs.twimg.com/media/CWCXj35VEAIFvtk.jpg,English_springer,0.9903,True,,0.002812464097967146,0.018281016636786447
1581,675534494439489536,2015-12-12 04:35:48,Seriously guys?! Only send in dogs. I only rate dogs. This is a baby black bear... 11/10 https://t.co/H7kpabTfLj,11.0,,1940,3768937,468,https://pbs.twimg.com/media/CV_7CV6XIAEV05u.jpg,chow,0.749368,True,,0.012417294319326644,0.05147339952883267
1582,675531475945709568,2015-12-12 04:23:49,This is Ellie AKA Queen Slayer of the Orbs. Very self-motivated. Great yard. Rad foliage. 10/10 would pet diligently https://t.co/c9jmg3Xtzn,10.0,Ellie,1265,3768937,428,https://pbs.twimg.com/media/CV_4ShmUYAA3wNu.jpg,Pembroke,0.918441,True,,0.011355987112546588,0.03356384041441924
