,tweet_id,timestamp,text,rating_numerator,name,favorite_count,followers_count,retweet_count,jpg_url,breed,p1_conf,p1_dog,stage,retweet_p,favorite_p
1065,709198395643068416,2016-03-14 02:04:08,"From left to right:
Cletus, Jerome, Alejandro, Burp, &amp; Titson
None know where camera is. 45/50 would hug all at once https://t.co/sedre1ivTK",9.0,,2623,3768824,716,https://pbs.twimg.com/media/CdeUKpcWoAAJAWJ.jpg,,0.490783,True,,0.018997968597100845,0.06959730674608314
1066,709158332880297985,2016-03-13 23:24:56,Meet Rodney. He's a Ukranian Boomchicka. Outside but would like to be inside. Only has one ear (unfortunate) 10/10 https://t.co/FjAj3ggXrR,10.0,Rodney,2224,3768824,469,https://pbs.twimg.com/media/CddvvSwWoAUObQw.jpg,,0.212957,True,,0.01244420010061494,0.05901044994406743
1067,709042156699303936,2016-03-13 15:43:18,This is Klevin. He's addicted to sandwiches (yes a hotdog is a sandwich fight me) It's tearing his family apart 9/10 https://t.co/7BkkVNu5pd,9.0,Klevin,5174,3768825,1853,https://pbs.twimg.com/media/CdcGBB3WwAAGBuU.jpg,,0.8265790000000001,False,,0.049166517415905484,0.13728416681591743
1068,708845821941387268,2016-03-13 02:43:08,Here's a pupper with magic eyes. Not wearing a seat belt tho (irresponsible af). Very distracting to driver. 9/10 https://t.co/5DLJB4ssvI,9.0,,3217,3768825,1008,https://pbs.twimg.com/media/CdZTgynWwAATZcx.jpg,schipperke,0.74564,True,pupper,0.026745736403255657,0.0853581686599935
1069,708834316713893888,2016-03-13 01:57:25,Meet Malikai. He was rolling around having fun when he remembered the inevitable heat death of the universe. 10/10 https://t.co/Vd2FqHIIGn,10.0,Malikai,1848,3768825,568,https://pbs.twimg.com/media/CdZI_bpWEAAm1fs.jpg,,0.283945,True,,0.01507101019548533,0.049033850072635374
1070,708810915978854401,2016-03-13 00:24:26,This is Mister. He's a wonderful father to his two pups. Heartwarming af. 10/10 for all https://t.co/2KcuJXL2r4,10.0,Mister,17967,3768825,7800,https://pbs.twimg.com/media/CdYzwuYUIAAHPkB.jpg,golden_retriever,0.976139,True,,0.20696105550138305,0.4767268313068397
1071,708738143638450176,2016-03-12 19:35:15,This is Coco. She gets to stay on the Bachelor for another week. Super pumped 11/10 https://t.co/wsCB6LFNxD,11.0,Coco,2984,3768825,914,https://pbs.twimg.com/media/CdXxlFPWwAABaOv.jpg,Pomeranian,0.933457,True,,0.02425159034977745,0.07917587046360602
1072,708711088997666817,2016-03-12 17:47:45,This is Smokey. He really likes tennis balls. 11/10 https://t.co/Ah7WlYTUBQ,11.0,Smokey,2771,3768825,829,https://pbs.twimg.com/media/CdXY-GHWoAALing.jpg,,0.912961,False,,0.021996245514185456,0.07352424164029903
1073,708479650088034305,2016-03-12 02:28:06,Meet Bear. He's a Beneboop Cumberclap. Extremely unamused. 13/10 I'm in love with this picture https://t.co/uC8kUqAz0W,13.0,Bear,2756,3768825,760,https://pbs.twimg.com/media/CdUGcLMWAAI42q0.jpg,,0.218479,True,,0.020165436177057836,0.07312623961048868
1074,708469915515297792,2016-03-12 01:49:25,This is Bobble. He's a Croatian Galifianakis. Hears everything within 400 miles. 11/10 would snug diligently https://t.co/VwDc6PTDzk,11.0,Bobble,3343,3768825,921,https://pbs.twimg.com/media/CdT9n7mW0AQcpZU.jpg,Chihuahua,0.748163,True,,0.024437324630355615,0.08870138571040045
1075,708356463048204288,2016-03-11 18:18:36,This is Oliver. That is his castle. He protects it with his life. He's also squishy af. 10/10 would squish softly https://t.co/oSuEGw0BhX,10.0,Oliver,3907,3768825,1511,https://pbs.twimg.com/media/CdSWcc1XIAAXc6H.jpg,pug,0.871283,True,,0.040092071136229465,0.10366626203126969
1076,708349470027751425,2016-03-11 17:50:48,This is River. He's changing the trumpet game. Innovative af. 11/10 such a good boy https://t.co/tK7a0AxQfd,11.0,River,2552,3768825,829,https://pbs.twimg.com/media/CdSQFWOWAAApgfq.jpg,,0.24389,False,,0.021996245514185456,0.06771341200506789
1077,708149363256774660,2016-03-11 04:35:39,This is Jebberson. He's the reigning hide and seek world champion. 10/10 hasn't lost his touch https://t.co/VEFkvWCoHF,10.0,Jebberson,4639,3768825,1722,https://pbs.twimg.com/media/CdPaEkHW8AA-Wom.jpg,,0.350993,True,,0.045690633022228415,0.12308876108601487
1078,708130923141795840,2016-03-11 03:22:23,Please stop sending in non canines like this Guatemalan Twiggle Bunny. We only rate dogs. Only send in dogs... 11/10 https://t.co/XKhobeGuvT,11.0,,3682,3768825,935,https://pbs.twimg.com/media/CdPJUWIWIAAIchl.jpg,French_bulldog,0.710354,True,,0.02480879319151194,0.0976962315841144
1079,708119489313951744,2016-03-11 02:36:57,This is Cooper. He basks in the glory of rebellion. 9/10 probably a preteen https://t.co/kDamUfeIpm,9.0,Cooper,2924,3768825,1101,https://pbs.twimg.com/media/CdO-6x5W8AENSBJ.jpg,,0.264483,True,,0.02921334898807984,0.07758386234436462
1080,708109389455101952,2016-03-11 01:56:49,This is Remington. He was caught off guard by the magical floating cheese. Spooked af. 10/10 deep breaths pup https://t.co/mhPSADiJmZ,10.0,Remington,2109,3768826,606,https://pbs.twimg.com/media/CdO1u9vWAAApj2V.jpg,Staffordshire_bullterrier,0.5161060000000001,True,,0.016079277737948105,0.05595907054345305
1081,708026248782585858,2016-03-10 20:26:26,Everybody stop what you're doing and watch this video. Frank is stuck in a loop. 13/10 (Vid by @klbmatty) https://t.co/5AJs8TIV1U,13.0,,4772,3768827,2158,https://pbs.twimg.com/ext_tw_video_thumb/708026062568087553/pu/img/rNhylAwIfb6YthGu.jpg,malinois,0.7864680000000001,True,,0.05725919496968154,0.12661764522489358
1082,707995814724026368,2016-03-10 18:25:30,This is Farfle. He lost his back legs during the Battle of Gettysburg. Goes 0-60 in 4.3 seconds (damn) 12/10 hero af https://t.co/NiQQWzIzzq,12.0,Farfle,3372,3768827,1268,https://pbs.twimg.com/media/CdNOb17WwAA5z4A.jpg,,0.172087,False,,0.033644420399238276,0.0894708088219491
1083,707969809498152960,2016-03-10 16:42:10,Meet Rufus. He's a Honeysuckle Firefox. Curly af. Badass tie. About to go on his first date ever 11/10 good luck pup https://t.co/dGoTWNfIsm,11.0,Rufus,2932,3768828,1090,https://pbs.twimg.com/media/CdM2xRpXEAUsR4k.jpg,toy_poodle,0.908491,True,,0.028921457811287753,0.07779606816761073
1084,707776935007539200,2016-03-10 03:55:45,This is Sadie. She's a Bohemian Rhapsody. Remarkably portable. Could sneak on roller coasters with (probably). 11/10 https://t.co/DB8fyeDs8B,11.0,Sadie,3570,3768828,1072,https://pbs.twimg.com/media/CdKHWimWoAABs08.jpg,miniature_pinscher,0.890426,True,,0.02844385575568851,0.09472440769385072
1085,707741517457260545,2016-03-10 01:35:01,When your roommate eats your leftover Chili's but you pretend it's no big deal cuz you fat anyway. 10/10 head up pup https://t.co/0nMgoue8IR,10.0,,2706,3768828,691,https://pbs.twimg.com/media/CdJnJ1dUEAARNcf.jpg,whippet,0.738371,True,,0.018334612245504436,0.07179950902508685
1086,707693576495472641,2016-03-09 22:24:31,This is Jiminus. He's in a tub for some reason. What a jokester. Smh 7/10 churlish af https://t.co/84L4ED9Tpi,7.0,Jiminus,3739,3768828,1121,https://pbs.twimg.com/media/CdI7jDnW0AA2dtO.jpg,,0.499525,False,,0.02974399468481979,0.09920856032697699
1087,707610948723478529,2016-03-09 16:56:11,This is Harper. She scraped her elbow attempting a backflip off a tree. Valiant effort tho. 12/10 https://t.co/oHKJHghrp5,12.0,Harper,18484,3768828,7196,https://pbs.twimg.com/media/CdHwZd0VIAA4792.jpg,,0.383223,True,,0.19093468844956576,0.49044424420536037
1088,707420581654872064,2016-03-09 04:19:44,This is Keurig. He's a rare dog. Laughs like an idiot tho. Head is basically a weapon. Poorly maintained goatee 4/10 https://t.co/xOrUyj7K30,4.0,Keurig,2487,3768828,785,https://pbs.twimg.com/media/CdFDQVgWIAArslx.jpg,,0.518215,False,,0.02082875631363384,0.065988684015296
1089,707411934438625280,2016-03-09 03:45:22,"""I shall trip the big pupper with leash. Big pupper will never see it coming. I am a genius."" Both 11/10 https://t.co/uQsCJ8pf51",11.0,,2475,3768830,670,https://pbs.twimg.com/media/CdE7ZktXIAEiWLj.jpg,Lakeland_terrier,0.7382770000000001,True,pupper,0.017777400413390893,0.065670247795735
1090,707387676719185920,2016-03-09 02:08:59,Meet Clarkus. He's a Skinny Eastern Worcestershire. Can tie own shoes (impressive af) 10/10 would put on track team https://t.co/XP5o7zGn0E,10.0,Clarkus,3823,3768830,1478,https://pbs.twimg.com/media/CdElVm7XEAADP6o.jpg,Chihuahua,0.888468,True,,0.039216414643271254,0.10143731609013938
1091,707377100785885184,2016-03-09 01:26:57,This dog just brutally murdered a snowman. Currently toying with its nutritious remains 9/10 would totally still pet https://t.co/iKThgKnW1j,9.0,,3585,3768831,1208,https://pbs.twimg.com/media/CdEbt0NXIAQH3Aa.jpg,golden_retriever,0.637225,True,,0.03205237910641257,0.09512233368914659
1092,707315916783140866,2016-03-08 21:23:50,This is Finnegus. He's trapped in a snow globe. Poor pupper. 10/10 would make sure no one shook it https://t.co/BjpOa52jQ4,10.0,Finnegus,2691,3768831,725,https://pbs.twimg.com/media/CdDkEkHWwAAAeUJ.jpg,Bernese_mountain_dog,0.979235,True,pupper,0.01923673414913006,0.07140145047628828
1093,707297311098011648,2016-03-08 20:09:54,This is Cassie. She can go from sweet to scary af in a matter of seconds. 10/10 points deducted for cats on pajamas https://t.co/B6dmZmJBdK,10.0,Cassie,3008,3768832,901,https://pbs.twimg.com/media/CdDTJLMW4AEST--.jpg,,0.370717,True,,0.023906610854503463,0.07981252547208259
1094,707059547140169728,2016-03-08 04:25:07,Say hello to Cupcake. She's an Icelandic Dippen Dot. Confused by the oddly geometric lawn pattern. 11/10 https://t.co/D7rorf4YKL,11.0,Cupcake,2790,3768832,754,https://pbs.twimg.com/media/Cc_64zVWEAAeXs7.jpg,Samoyed,0.8973120000000001,True,,0.020006198206765385,0.0740282400489064
1095,707038192327901184,2016-03-08 03:00:15,This is Kathmandu. He sees every move you make. Probably knows Jiu-Jitsu. 10/10 mysterious af https://t.co/z0cs7E4Xjj,10.0,Kathmandu,2391,3768833,897,https://pbs.twimg.com/media/Cc_ney1W4AANuY3.jpg,pug,0.642426,True,,0.023800470861935246,0.06344138888616184
1096,707021089608753152,2016-03-08 01:52:18,This is Tucker. He's a Dasani Episcopalian. Good lord what a tongue. 12/10 would never let go of https://t.co/gHtW5cgyy7,12.0,Tucker,4424,3768833,1535,https://pbs.twimg.com/media/Cc_XtkRW8AEE7Fn.jpg,cocker_spaniel,0.559658,True,,0.04072878792984459,0.1173838161574153
1097,707014260413456384,2016-03-08 01:25:10,This is Ellie. She requests to be carried around in a lacrosse stick at all times. 11/10 impossible to say no https://t.co/15yCmd43zU,11.0,Ellie,2496,3768833,659,https://pbs.twimg.com/media/Cc_RsVlXEAIzzlX.jpg,Chihuahua,0.58378,True,,0.017485518726884423,0.0662273971810372
1098,706901761596989440,2016-03-07 17:58:08,This is Elliot. He's blocking the roadway. Downright rude as hell. Doesn't care that you're already late. 3/10 https://t.co/FMUxir5pYu,3.0,Elliot,2255,3768833,676,https://pbs.twimg.com/media/Cc9rZlBWwAA56Ra.jpg,,0.859499,False,,0.01793658673653091,0.05983284480898995
1099,706681918348251136,2016-03-07 03:24:33,Say hello to Katie. She's a Mitsubishi Hufflepuff. Curly af. 12/10 I'd do terrible things to acquire such a pup https://t.co/CFPIcGcwJv,12.0,Katie,3608,3768833,1091,https://pbs.twimg.com/media/Cc6jcYRXIAAFuox.jpg,toy_poodle,0.717584,True,,0.02894795285437163,0.09573255169438391
1100,706644897839910912,2016-03-07 00:57:27,Meet Shadow. She's tired of the responsibilities associated with being a dog. No longer strives to attain ball. 9/10 https://t.co/cdOkfEpjFw,9.0,Shadow,2804,3768833,1220,https://pbs.twimg.com/ext_tw_video_thumb/706644797256241152/pu/img/NTqvmIUQExGmKFSR.jpg,,0.137871,False,,0.032370763045218506,0.07439968817933827
1101,706593038911545345,2016-03-06 21:31:22,Here's a sneak peek of me on spring break. 10/10 so many tired pups these days https://t.co/6aJrjKfNqX,10.0,,2350,3768833,716,https://pbs.twimg.com/media/Cc5Snc7XIAAMidF.jpg,,0.6964229999999999,False,,0.018997923229816763,0.062353518980543844
1102,706538006853918722,2016-03-06 17:52:42,"This is Oliver (pronounced ""Ricardo""). He's a ship captain. Controls these treacherous waters. 11/10 would sail with https://t.co/bxjO45rXKd",11.0,Oliver,3757,3768833,1574,https://pbs.twimg.com/media/Cc4gjxqW4AIoThO.jpg,chow,0.541794,True,,0.0417635910107983,0.09968603013187372
1103,706516534877929472,2016-03-06 16:27:23,Please enjoy this pup in a cooler. Permanently ready for someone to throw a tennis ball his way. 12/10 https://t.co/KUS0xl7XIp,12.0,,3388,3768833,1147,https://pbs.twimg.com/media/Cc4NCQiXEAEx2eJ.jpg,golden_retriever,0.7726850000000001,True,,0.03043382394497183,0.08989520098131172
1104,706346369204748288,2016-03-06 05:11:12,This is Koda. She's a Beneboom Cumberwiggle. 12/10 petable as hell https://t.co/VZV6oMJmU6,12.0,Koda,3755,3768833,1030,https://pbs.twimg.com/media/Cc1yRE2WoAAgxFQ.jpg,Tibetan_mastiff,0.956462,True,,0.02732941470211071,0.09963296330720942
1105,706310011488698368,2016-03-06 02:46:44,Here's a very sleepy pupper. Thinks it's an airplane. 12/10 would snug for eternity https://t.co/GGmcTIkBbf,12.0,,23355,3768833,8987,https://pbs.twimg.com/media/Cc1RNHLW4AACG6H.jpg,Pembroke,0.6981649999999999,True,pupper,0.23845577662899897,0.6196878450172773
1106,706291001778950144,2016-03-06 01:31:11,When you're just relaxin and having a swell time but then remember you have to fill out the FAFSA ...11/10 https://t.co/qy33OBcexg,11.0,,1850,3768833,521,https://pbs.twimg.com/media/Cc0_2tXXEAA2iTY.jpg,Border_terrier,0.587101,True,,0.013823907825048231,0.049086812814470686
1107,706265994973601792,2016-03-05 23:51:49,"This is Kara. She's been trying to solve that thing for 3 days. ""I don't have thumbs,"" she said. 11/10 solid effort https://t.co/lA6a8GefrV",11.0,Kara,2964,3768833,1027,https://pbs.twimg.com/media/Cc0pLU0WAAEfGEw.jpg,papillon,0.743715,True,,0.027249814465114267,0.07864503415248168
1108,706166467411222528,2016-03-05 17:16:20,This is Dexter. He's a shy pup. Doesn't bark much. Dreadful fetcher. Has rare sun allergy. 7/10 still petable https://t.co/sA7P3JSqiv,7.0,Dexter,5605,3768834,1811,https://pbs.twimg.com/media/CczOp_OWoAAo5zR.jpg,,0.430418,True,,0.04805199698368249,0.14871973666125915
1109,705975130514706432,2016-03-05 04:36:02,This is Adele. Her tongue flies out of her mouth at random. It's a debilitating illness. 10/10 stay strong pupper https://t.co/cfn81n3FLO,10.0,Adele,3386,3768833,838,https://pbs.twimg.com/media/CcwgjmuXIAEQoSd.jpg,Staffordshire_bullterrier,0.5877640000000001,True,pupper,0.022234999534338613,0.08984213415664742
1110,705970349788291072,2016-03-05 04:17:02,This is Lucy. She's a Venetian Kerploof. Supposed to be navigating. Quite irresponsible. Fancy ass collar tho 12/10 https://t.co/8tjnz1L8DI,12.0,Lucy,3424,3768834,1005,https://pbs.twimg.com/media/CcwcSS9WwAALE4f.jpg,golden_retriever,0.776346,True,,0.026666072318388127,0.09085037971956313
1111,705898680587526145,2016-03-04 23:32:15,Meet Max. He's a Fallopian Cephalopuff. Eyes are magical af. Lil dandruff problem. No big deal 10/10 would still pet https://t.co/c67nUjwmFs,10.0,Max,2582,3768835,640,https://pbs.twimg.com/media/CcvbGj5W8AARjB6.jpg,collie,0.808276,True,,0.01698137488109721,0.06850923428592655
1113,705591895322394625,2016-03-04 03:13:11,"""Ma'am, for the last time, I'm not authorized to make that type of transaction"" 11/10 https://t.co/nPTBsdm3BF",11.0,,3453,3768835,1301,https://pbs.twimg.com/media/CcrEFQdUcAA7CJf.jpg,basenji,0.877207,True,,0.03451995112548042,0.09161982416316979
1114,705475953783398401,2016-03-03 19:32:29,Say hello to Zara. She found a sandal and couldn't be happier. 12/10 great work https://t.co/zQUuVu812n,12.0,Zara,3220,3768836,1042,https://pbs.twimg.com/media/CcpaoR9WAAAKlJJ.jpg,golden_retriever,0.908784,True,,0.0276477936423872,0.08543751970104298
1115,705442520700944385,2016-03-03 17:19:38,This is Cooper. He only wakes up to switch gears. 12/10 helpful af https://t.co/EEIkAGVY64,12.0,Cooper,4860,3768836,1850,https://pbs.twimg.com/media/Cco8OmOXIAE0aCu.jpg,,0.309106,True,,0.04908677374128246,0.1289522812879096
1116,705428427625635840,2016-03-03 16:23:38,This is Ambrose. He's an Alfalfa Ballyhoo. Draws pistol fast af. Pretty much runs the frontier. 11/10 lethal pupper https://t.co/ih6epBOxIA,11.0,Ambrose,4173,3768836,1924,https://pbs.twimg.com/media/CcovaMUXIAApFDl.jpg,Chihuahua,0.774792,True,pupper,0.05105024469093375,0.11072384152560633
1117,705239209544720384,2016-03-03 03:51:44,This is Jimothy. He lost his body during the the Third Crusade (tragic). 11/10 heroic af tho https://t.co/wnsblfu7XE,11.0,Jimothy,3271,3768836,848,https://pbs.twimg.com/media/CcmDUjFW8AAqAjc.jpg,,0.15795,True,,0.022500315747355417,0.08679072265282968
1118,705223444686888960,2016-03-03 02:49:06,This is Bode. He's a heavy sleeper. 9/10 https://t.co/YMkxhGWUqv,9.0,Bode,2816,3768836,898,https://pbs.twimg.com/media/Ccl0-HVVAAAf8aK.jpg,,0.0905082,False,,0.02382698530793062,0.07471802965159535
1119,705102439679201280,2016-03-02 18:48:16,This is Terrenth. He just stubbed his toe. 10/10 deep breaths Terrenth https://t.co/Pg18CDFC7Z,10.0,Terrenth,2339,3768836,580,https://pbs.twimg.com/media/CckG63qUsAALbIr.jpg,,0.457672,True,,0.015389366902672338,0.06206160204370793
1120,705066031337840642,2016-03-02 16:23:36,This is Reese. He's a Chilean Sohcahtoa. Loves to swing. Never sure what to do with his feet. 12/10 huggable af https://t.co/VA6jnNUyuW,12.0,Reese,2363,3768836,680,https://pbs.twimg.com/media/CcjlzRkW0AMqmWg.jpg,Airedale,0.868658,True,,0.01804270602382274,0.06269840343278402
1122,704859558691414016,2016-03-02 02:43:09,Here is a heartbreaking scene of an incredible pupper being laid to rest. 10/10 RIP pupper https://t.co/81mvJ0rGRu,10.0,,2452,3768836,609,https://pbs.twimg.com/media/CcgqBNVW8AE76lv.jpg,,0.284428,True,pupper,0.016158835247805953,0.06505987525060788
1123,704847917308362754,2016-03-02 01:56:53,"""Yes hi could I get a number 4 with no pickles"" ...12/10 https://t.co/kQPVxqA3gq",12.0,,5571,3768836,1722,https://pbs.twimg.com/media/CcgfcANW4AA9hzr.jpg,golden_retriever,0.85724,True,,0.04569049966620994,0.14781752243928895
1124,704819833553219584,2016-03-02 00:05:17,This is Chesterson. He's a Bolivian Scoop Dog. Incredibly portable. Can't bark for shit tho. 7/10 would still pet https://t.co/EatAd8JhyW,7.0,Chesterson,2886,3768836,1130,https://pbs.twimg.com/media/CcgF5ovW8AACrEU.jpg,,0.994776,False,,0.02998273206899955,0.07657536703640062
1125,704761120771465216,2016-03-01 20:11:59,This pupper killed this great white in an epic sea battle. Now wears it as a trophy. Such brave. Much fierce. 13/10 https://t.co/Lu0ECu5tO5,13.0,,7243,3768836,3244,https://pbs.twimg.com/media/CcfQgHVWoAAxauy.jpg,,0.202294,False,pupper,0.08607432109011907,0.1921813525449237
1126,704499785726889984,2016-03-01 02:53:32,When you wake up from a long nap and have no idea who you are. 12/10 https://t.co/dlF93GLnDc,12.0,,3196,3768836,1119,https://pbs.twimg.com/media/Ccbi0UGWoAA4fwg.jpg,,0.376541,True,,0.02969086476567301,0.08480071831196688
1127,704480331685040129,2016-03-01 01:36:14,Meet Lucia. She's a Cumulonimbus Floofmallow. Only has two legs tho (unfortunate). 11/10 would definitely still pet https://t.co/qv6qlEUCEe,11.0,Lucia,3707,3768836,1193,https://pbs.twimg.com/media/CcbRIAgXIAQaKHQ.jpg,Samoyed,0.979206,True,,0.03165433571532431,0.09835928122104544
1128,704364645503647744,2016-02-29 17:56:32,Say hello to Bisquick. He's a Beneplop Cumbersnug. Even smiles when wet. 12/10 I'd steal Bisquick https://t.co/5zX5XD3i6K,12.0,Bisquick,8761,3768836,3972,https://pbs.twimg.com/media/CcZn6RWWIAAmOZG.jpg,Pembroke,0.980695,True,,0.10539062989209401,0.2324590404039868
1129,704347321748819968,2016-02-29 16:47:42,This is Ralphson. He's very confused. Wondering why he's sitting on Santa's lap in February. 10/10 stay woke pupper https://t.co/INphk4ltkZ,10.0,Ralphson,1722,3768838,390,https://pbs.twimg.com/media/CcZYJniXEAAEJRF.jpg,,0.23337800000000006,False,pupper,0.010348017081126861,0.04569047541974476
1130,704113298707505153,2016-02-29 01:17:46,Meet Stanley. He's an inverted Uzbekistani water pup. Hella exotic. Floats around all day. 8/10 I want to be Stanley https://t.co/XpYMBQ1FD8,8.0,Stanley,2022,3768839,629,https://pbs.twimg.com/media/CcWDTerUAAALORn.jpg,,0.945537,False,,0.016689489787173186,0.05365047432379043
1131,704054845121142784,2016-02-28 21:25:30,Here is a whole flock of puppers.  60/50 I'll take the lot https://t.co/9dpcw6MdWa,12.0,,3193,3768840,1023,https://pbs.twimg.com/media/CcVOJEcXEAM0FHL.jpg,Great_Pyrenees,0.6679390000000001,True,,0.027143630400866047,0.08472102822088494
1132,703774238772166656,2016-02-28 02:50:28,"""YOU CAN'T HANDLE THE TRUTH"" both 10/10 https://t.co/ZvxdB4i9AG",10.0,,2015,3768840,523,https://pbs.twimg.com/media/CcRO8FmW4AAzazk.jpg,Labrador_retriever,0.990119,True,,0.013876948875516073,0.0534647265471604
1133,703769065844768768,2016-02-28 02:29:55,When you're trying to watch your favorite tv show but your friends keep interrupting. 10/10 relatable af https://t.co/QQZDCYl6zT,10.0,,3609,3768840,1267,https://pbs.twimg.com/media/CcRKOzyXEAQO_HN.jpg,boxer,0.838994,True,,0.033617770985236835,0.09575890724997611
1134,703631701117943808,2016-02-27 17:24:05,This is Bella. Based on this picture she's at least 8ft tall (wow)! Must be rare. 11/10 would pet on tippy toes https://t.co/XTVbSRdvcp,11.0,Bella,2840,3768840,766,https://pbs.twimg.com/media/CcPNS4yW8AAd-Et.jpg,,0.909533,False,,0.02032455609683616,0.07535475106398785
1135,703611486317502464,2016-02-27 16:03:45,Meet Scooter. He's experiencing the pupper equivalent of dropping ur phone in a toilet 10/10 put it in some rice pup https://t.co/JSmX1FIEaW,10.0,Scooter,4214,3768840,1698,https://pbs.twimg.com/media/CcO66OjXEAASXmH.jpg,Pembroke,0.756441,True,pupper,0.04505365046008852,0.1118115918956496
1137,703407252292673536,2016-02-27 02:32:12,This pupper doesn't understand gates. 10/10 so close https://t.co/GUbFF4o6dZ,10.0,,2677,3768840,779,https://pbs.twimg.com/media/CcMBJODUsAI5-A9.jpg,,0.201058,False,pupper,0.020669489816495263,0.07102981288672376
1138,703382836347330562,2016-02-27 00:55:11,This is Charlie. He's a West Side Niddlewog. Mucho fluffy. 12/10 would pet so damn well https://t.co/B9dOrmnPVt,12.0,Charlie,3821,3768840,1280,https://pbs.twimg.com/media/CcLq7ipW4AArSGZ.jpg,golden_retriever,0.945664,True,,0.03396270470489594,0.10138398021672451
1139,703356393781329922,2016-02-26 23:10:06,This is Socks. That water pup w the super legs just splashed him. Socks did not appreciate that. 9/10 and 2/10 https://t.co/8rc5I22bBf,9.0,Socks,2079,3768840,429,https://pbs.twimg.com/media/CcLS6QKUcAAUuPa.jpg,Border_collie,0.894842,True,,0.011382812748750278,0.0551628617824052
1140,703268521220972544,2016-02-26 17:20:56,Happy Friday here's a sleepy pupper 12/10 https://t.co/eBcqv9SPkY,12.0,,2143,3768841,617,https://pbs.twimg.com/media/CcKC-5LW4AAK-nb.jpg,,0.5254340000000001,False,pupper,0.0163710806584836,0.05686098193051922
1141,703079050210877440,2016-02-26 04:48:02,This is a Butternut Cumberfloof. It's not windy they just look like that. 11/10 back at it again with the red socks https://t.co/hMjzhdUHaW,11.0,,8044,3768841,3480,https://pbs.twimg.com/media/CcHWqQCW8AEb0ZH.jpg,Pembroke,0.778503,True,,0.09233607891656878,0.2134343157485285
1142,703041949650034688,2016-02-26 02:20:37,This is an East African Chalupa Seal. We only rate dogs. Please only send in dogs. Thank you... 10/10 https://t.co/iHe6liLwWR,10.0,,28862,3768841,14089,https://pbs.twimg.com/media/CcG07BYW0AErrC9.jpg,,0.581403,False,,0.373828452832051,0.7658057211752897
1143,702932127499816960,2016-02-25 19:04:13,This is Chip. He's an Upper West Nile Pantaloon. Extremely deadly. Will rip your throat out. 6/10 might still pet https://t.co/LUFnwzznaV,6.0,Chip,2813,3768841,807,https://pbs.twimg.com/media/CcFRCfRW4AA5a72.jpg,,0.41071,False,,0.021412418300480174,0.07463833045755977
1144,702684942141153280,2016-02-25 02:42:00,This is Lucy. She's sick of these bullshit generalizations 11/10 https://t.co/d2b5C2R0aO,11.0,Lucy,3508,3768842,1212,https://pbs.twimg.com/media/CcBwOn0XEAA7bNQ.jpg,golden_retriever,0.514085,True,,0.032158418952028235,0.0930789881878837
1145,702671118226825216,2016-02-25 01:47:04,Meet Rambo &amp; Kiwi. Rambo's the pup with the sharp toes &amp; rad mohawk. One stays woke while one sleeps. 10/10 for both https://t.co/MpH1Fe9LhZ,10.0,Rambo,2390,3768842,632,https://pbs.twimg.com/media/CcBjp2nWoAA8w-2.jpg,,0.381227,True,,0.016769076549242444,0.06341470403906559
1146,702598099714314240,2016-02-24 20:56:55,"This is Sansa. She's gotten too big for her chair. Not so smol anymore. 11/10 once a pupper, always a pupper https://t.co/IpAoztle2s",11.0,Sansa,11278,3768842,3691,https://pbs.twimg.com/media/CcAhPevW8AAoknv.jpg,,0.219179,True,pupper,0.09793459104945233,0.29924310968727263
1147,702539513671897089,2016-02-24 17:04:07,This is a Wild Tuscan Poofwiggle. Careful not to startle. Rare tongue slip. One eye magical. 12/10 would def pet https://t.co/4EnShAQjv6,12.0,,3122,3768842,1083,https://pbs.twimg.com/media/Cb_r8qTUsAASgdF.jpg,Pomeranian,0.714367,True,,0.028735616934856913,0.08283711548534006
1148,702321140488925184,2016-02-24 02:36:23,Please enjoy this picture as much as I did. 12/10 https://t.co/7u8mM99Tj5,12.0,,3590,3768845,1150,https://pbs.twimg.com/media/Cb8lWafWEAA2q93.jpg,West_Highland_white_terrier,0.769159,True,,0.030513327027245747,0.09525464698070629
1149,702276748847800320,2016-02-23 23:39:59,"""AND IIIIIIIIIIIEIIIIIIIIIIIII WILL ALWAYS LOVE YOUUUUU"" 11/10 https://t.co/rSNCEiTtfI",11.0,,2695,3769001,855,https://pbs.twimg.com/media/Cb78-nOWIAENNRc.jpg,Boston_bull,0.697303,True,,0.022685056331903337,0.07150435884734443
1150,702217446468493312,2016-02-23 19:44:20,"I know it's tempting, but please stop sending in pics of Donald Trump. Thank you ...9/10 https://t.co/y35Y1TJERY",9.0,,5243,3768845,1515,https://pbs.twimg.com/media/Cb7HCMkWEAAV9zY.jpg,,0.242419,True,,0.04019799169241505,0.13911423791639083
