,tweet_id,timestamp,text,rating_numerator,name,favorite_count,followers_count,retweet_count,jpg_url,breed,p1_conf,p1_dog,stage,retweet_p,favorite_p
0,892420643555336193,2017-08-01 16:23:56,This is Phineas. He's a mystical boy. Only ever appears in the hole of a donut. 13/10 https://t.co/MgUWQ76dJU,13.0,Phineas,39492,3768791,8842,https://pbs.twimg.com/media/DGKD1-bXoAAIAUK.jpg,,0.0970486,False,,0.2346110463541226,1.047869197310225
1,892177421306343426,2017-08-01 00:17:27,"This is Tilly. She's just checking pup on you. Hopes you're doing ok. If not, she's available for pats, snugs, boops, the whole bit. 13/10 https://t.co/0Xxu71qeIV",13.0,Tilly,33786,3768791,6480,https://pbs.twimg.com/media/DGGmoV4XsAAUL6n.jpg,,0.323581,True,,0.1719384279998546,0.8964678593214641
2,891815181378084864,2017-07-31 00:18:03,This is Archie. He is a rare Norwegian Pouncing Corgo. Lives in the tall grass. You never know when one may strike. 12/10 https://t.co/wUnZnhtVJB,12.0,Archie,25445,3768791,4301,https://pbs.twimg.com/media/DGBdLU1WsAANxJ9.jpg,Chihuahua,0.716012,True,,0.11412147821410101,0.6751502006877006
3,891689557279858688,2017-07-30 15:58:51,This is Darla. She commenced a snooze mid meal. 13/10 happens to the best of us https://t.co/tD36da7qLQ,13.0,Darla,42863,3768791,8925,https://pbs.twimg.com/media/DF_q7IAWsAEuuN8.jpg,,0.17027799999999998,False,,0.2368133441201701,1.137314327061384
4,891327558926688256,2017-07-29 16:00:24,"This is Franklin. He would like you to stop calling him ""cute."" He is a very fierce shark and should be respected as such. 12/10 #BarkWeek https://t.co/AtUZn91f7f",12.0,Franklin,41016,3768791,9721,https://pbs.twimg.com/media/DF6hr6BUMAAzZgT.jpg,basset,0.555712,True,,0.2579341757078066,1.0883065683398203
5,891087950875897856,2017-07-29 00:08:17,Here we have a majestic great white breaching off South Africa's coast. Absolutely h*ckin breathtaking. 13/10 (IG: tucker_marlo) #BarkWeek https://t.co/kQ04fDDRmh,13.0,,20548,3768791,3240,https://pbs.twimg.com/media/DF3HwyEWsAABqE6.jpg,,0.425595,True,,0.0859692139999273,0.545214632490897
6,890971913173991426,2017-07-28 16:27:12,"Meet Jax. He enjoys ice cream so much he gets nervous around it. 13/10 help Jax enjoy more things by clicking below

https://t.co/Zr4hWfAs1H https://t.co/tVJBRMnhxl",13.0,Jax,12053,3768791,2142,https://pbs.twimg.com/media/DF1eOmZXUAALUcq.jpg,,0.34170300000000003,True,,0.056835202588840825,0.31981078282133446
7,890729181411237888,2017-07-28 00:22:40,When you watch your owner call another dog a good boy but then they turn back to you and say you're a great boy. 13/10 https://t.co/v0nONBcwxq,13.0,,66596,3768791,19548,https://pbs.twimg.com/media/DFyBahAVwAAhUTd.jpg,Pomeranian,0.566142,True,,0.518680924466228,1.7670388196108513
8,890609185150312448,2017-07-27 16:25:51,This is Zoey. She doesn't want to be one of the scary sharks. Just wants to be a snuggly pettable boatpet. 13/10 #BarkWeek https://t.co/9TwLuAGH0b,13.0,Zoey,28187,3768791,4403,https://pbs.twimg.com/media/DFwUU__XcAEpyXI.jpg,,0.487574,True,,0.11682791643261727,0.7479056280913429
9,890240255349198849,2017-07-26 15:59:51,This is Cassie. She is a college pup. Studying international doggo communication and stick theory. 14/10 so elegant much sophisticate https://t.co/t1bfwz5S2A,14.0,Cassie,32467,3768792,7684,https://pbs.twimg.com/media/DFrEyVuW0AAO3t9.jpg,Pembroke,0.511319,True,doggo,0.2038849583633164,0.861469669857079
10,890006608113172480,2017-07-26 00:31:25,This is Koda. He is a South Australian deckshark. Deceptively deadly. Frighteningly majestic. 13/10 would risk a petting #BarkWeek https://t.co/dVPW0B0Mme,13.0,Koda,31127,3768793,7584,https://pbs.twimg.com/media/DFnwSY4WAAAMliS.jpg,Samoyed,0.957979,True,,0.20123153487071324,0.8259142913924963
11,889880896479866881,2017-07-25 16:11:53,This is Bruno. He is a service shark. Only gets out of the water to assist you. 13/10 terrifyingly good boy https://t.co/u1XPQMl29g,13.0,Bruno,28208,3768916,5116,https://pbs.twimg.com/media/DFl99B1WsAITKsg.jpg,,0.377417,True,,0.13574194808268478,0.7484380124152409
12,889665388333682689,2017-07-25 01:55:32,Here's a puppo that seems to be on the fence about something haha no but seriously someone help her. 13/10 https://t.co/BxvuXk0UCm,13.0,,38745,3768793,8502,https://pbs.twimg.com/media/DFi579UWsAAatzw.jpg,Pembroke,0.966327,True,puppo,0.22558946591123472,1.0280479718573028
13,889638837579907072,2017-07-25 00:10:02,This is Ted. He does his best. Sometimes that's not enough. But it's ok. 12/10 would assist https://t.co/f8dEDcrKSR,12.0,Ted,27633,3768793,4705,https://pbs.twimg.com/media/DFihzFfXsAYGDPR.jpg,French_bulldog,0.99165,True,,0.12484103000615847,0.7332055647524287
14,889531135344209921,2017-07-24 17:02:04,This is Stuart. He's sporting his favorite fanny pack. Secretly filled with bones only. 13/10 puppared puppo #BarkWeek https://t.co/y70o6h3isq,13.0,Stuart,15329,3768793,2309,https://pbs.twimg.com/media/DFg_2PVW0AEHN3p.jpg,golden_retriever,0.953442,True,puppo,0.06126629931651858,0.4067349944663981
15,889278841981685760,2017-07-24 00:19:32,This is Oliver. You're witnessing one of his many brutal attacks. Seems to be playing with his victim. 13/10 fr*ckin frightening #BarkWeek https://t.co/WpHvrQedPb,13.0,Oliver,25712,3768793,5635,https://pbs.twimg.com/ext_tw_video_thumb/889278779352338437/pu/img/VlbFB3v8H8VwzVNY.jpg,whippet,0.626152,True,,0.149517365374007,0.6822343386861522
16,888917238123831296,2017-07-23 00:22:39,This is Jim. He found a fren. Taught him how to sit like the good boys. 12/10 for both https://t.co/chxruIOUJN,12.0,Jim,29555,3768793,4681,https://pbs.twimg.com/media/DFYRgsOUQAARGhO.jpg,golden_retriever,0.714719,True,,0.12420422135150432,0.7842033245126491
17,888804989199671297,2017-07-22 16:56:37,This is Zeke. He has a new stick. Very proud of it. Would like you to throw it for him without taking it. 13/10 would do my best https://t.co/HTQ77yNQ5K,13.0,Zeke,26021,3768793,4535,https://pbs.twimg.com/media/DFWra-3VYAA2piG.jpg,,0.46976,True,,0.12033030203569153,0.6904332501148245
18,888554962724278272,2017-07-22 00:23:06,This is Ralphus. He's powering up. Attempting maximum borkdrive. 13/10 inspirational af https://t.co/YnYAFCTTiK,13.0,Ralphus,20267,3768793,3722,https://pbs.twimg.com/media/DFTH_O-UQAACu20.jpg,Siberian_husky,0.700377,True,,0.098758408859282,0.5377583751614906
19,888078434458587136,2017-07-20 16:49:33,This is Gerald. He was just told he didn't get the job he interviewed for. A h*ckin injustice. 12/10 didn't want the job anyway https://t.co/DK7iDPfuRX,12.0,Gerald,22144,3768796,3637,https://pbs.twimg.com/media/DFMWn56WsAAkA7B.jpg,French_bulldog,0.995026,True,,0.09650296805664196,0.5875616509888039
20,887705289381826560,2017-07-19 16:06:48,This is Jeffrey. He has a monopoly on the pool noodles. Currently running a 'boop for two' midweek sale. 13/10 h*ckin strategic https://t.co/PhrUk20Q64,13.0,Jeffrey,30690,3768796,5584,https://pbs.twimg.com/media/DFHDQBbXgAEqY7t.jpg,basset,0.821664,True,,0.1481640290426969,0.8143184189327308
21,887517139158093824,2017-07-19 03:39:09,I've yet to rate a Venezuelan Hover Wiener. This is such an honor. 14/10 paw-inspiring af (IG: roxy.thedoxy) https://t.co/20VrLAA8ba,14.0,,46940,3768796,12053,https://pbs.twimg.com/ext_tw_video_thumb/887517108413886465/pu/img/WanJKwssZj4VJvL9.jpg,,0.130432,False,,0.3198103585336007,1.2454906023037595
22,887473957103951883,2017-07-19 00:47:34,This is Canela. She attempted some fancy porch pics. They were unsuccessful. 13/10 someone help her https://t.co/cLyzpcUcMX,13.0,Canela,70007,3768796,18813,https://pbs.twimg.com/media/DFDw2tyUQAAAFke.jpg,Pembroke,0.809197,True,,0.4991779868159486,1.8575428333080382
23,887343217045368832,2017-07-18 16:08:03,You may not have known you needed to see this today. 13/10 please enjoy (IG: emmylouroo) https://t.co/WZqNqygEyV,13.0,,34223,3768796,10713,https://pbs.twimg.com/ext_tw_video_thumb/887343120832229379/pu/img/6HSuFrW1lzI_9Mht.jpg,,0.330741,True,,0.2842552369510051,0.9080618850157981
24,887101392804085760,2017-07-18 00:07:08,This... is a Jubilant Antarctic House Bear. We only rate dogs. Please only send dogs. Thank you... 12/10 would suffocate in floof https://t.co/4Ad1jzJSdp,12.0,,31045,3768797,6147,https://pbs.twimg.com/media/DE-eAq6UwAA-jaE.jpg,Samoyed,0.733942,True,,0.1631024435648829,0.8237376542169822
25,886983233522544640,2017-07-17 16:17:36,This is Maya. She's very shy. Rarely leaves her cup. 13/10 would find her an environment to thrive in https://t.co/I6oNy0CgiT,13.0,Maya,35786,3768797,8045,https://pbs.twimg.com/media/DE8yicJW0AAAvBJ.jpg,Chihuahua,0.793469,True,,0.21346334122002325,0.9495337636917033
26,886736880519319552,2017-07-16 23:58:41,"This is Mingus. He's a wonderful father to his smol pup. Confirmed 13/10, but he needs your help

https://t.co/bVi0Yr4Cff https://t.co/ISvKOSkd5b",13.0,Mingus,12286,3768798,3420,https://pbs.twimg.com/media/DE5Se8FXcAAJFx4.jpg,,0.309706,True,,0.09074511289806458,0.3259925313057373
27,886680336477933568,2017-07-16 20:14:00,This is Derek. He's late for a dog meeting. 13/10 pet...al to the metal https://t.co/BCoWue0abA,13.0,Derek,22802,3768798,4597,https://pbs.twimg.com/media/DE4fEDzWAAAyHMM.jpg,,0.738995,False,,0.1219752292375447,0.6050204866379149
28,886366144734445568,2017-07-15 23:25:31,This is Roscoe. Another pupper fallen victim to spontaneous tongue ejections. Get the BlepiPen immediate. 12/10 deep breaths Roscoe https://t.co/RGE08MIJox,12.0,Roscoe,21488,3768798,3297,https://pbs.twimg.com/media/DE0BTnQUwAApKEH.jpg,French_bulldog,0.999201,True,pupper,0.08748147287278331,0.5701552590507637
29,886258384151887873,2017-07-15 16:17:19,This is Waffles. His doggles are pupside down. Unsure how to fix. 13/10 someone assist Waffles https://t.co/xZDA9Qsq1O,13.0,Waffles,28437,3768798,6506,https://pbs.twimg.com/media/DEyfTG4UMAE4aE9.jpg,pug,0.943575,True,,0.1726279837762597,0.7545376536497844
30,885984800019947520,2017-07-14 22:10:11,Viewer discretion advised. This is Jimbo. He will rip ur finger right h*ckin off. Other dog clearly an accessory. 12/10 pls pet with caution https://t.co/BuveP0uMF1,12.0,Jimbo,33299,3768799,7043,https://pbs.twimg.com/media/DEumeWWV0AA-Z61.jpg,Blenheim_spaniel,0.972494,True,,0.18687650893560523,0.8835440680174241
31,885528943205470208,2017-07-13 15:58:47,This is Maisey. She fell asleep mid-excavation. Happens to the best of us. 13/10 would pat noggin approvingly https://t.co/tp1kQ8i9JF,13.0,Maisey,36592,3768801,6642,https://pbs.twimg.com/media/DEoH3yvXgAAzQtS.jpg,,0.369275,True,,0.17623642107927692,0.9709188678309097
33,885167619883638784,2017-07-12 16:03:00,Here we have a corgi undercover as a malamute. Pawbably doing important investigative work. Zero control over tongue happenings. 13/10 https://t.co/44ItaMubBf,13.0,,22304,3768801,4526,https://pbs.twimg.com/media/DEi_N9qXYAAgEEw.jpg,malamute,0.8124819999999999,True,,0.12009124387305141,0.5918062535007819
34,884925521741709313,2017-07-12 00:01:00,"This is Earl. He found a hat. Nervous about what you think of it. 12/10 it's delightful, Earl https://t.co/MYJvdlNRVa",12.0,Earl,78881,3768801,19149,https://pbs.twimg.com/media/DEfjEaNXkAAtPlj.jpg,,0.259916,True,,0.5080926268062442,2.0929998691891663
35,884876753390489601,2017-07-11 20:47:12,This is Lola. It's her first time outside. Must test the earth and taste the atmosphere. 13/10 you're doing great Lola https://t.co/74TKAUsLkO,13.0,Lola,28429,3768801,6042,https://pbs.twimg.com/media/DEe2tZXXkAAwyX3.jpg,chow,0.822103,True,,0.1603162385066232,0.7543247839299555
36,884562892145688576,2017-07-11 00:00:02,This is Kevin. He's just so happy. 13/10 what is your secret Kevin https://t.co/1r4MFCbCX5,13.0,Kevin,24716,3768801,5076,https://pbs.twimg.com/media/DEaZQkfXUAEC7qB.jpg,pug,0.5464060000000001,True,,0.13468474456465065,0.6558053874428499
37,884441805382717440,2017-07-10 15:58:53,"I present to you, Pup in Hat. Pup in Hat is great for all occasions. Extremely versatile. Compact as h*ck. 14/10 (IG: itselizabethgales) https://t.co/vvBOcC2VdC",14.0,,27443,3768802,5836,https://pbs.twimg.com/media/DEYrIZwWsAA2Wo5.jpg,Pembroke,0.993225,True,,0.15485026806926974,0.7281624240275822
38,884162670584377345,2017-07-09 21:29:42,Meet Yogi. He doesn't have any important dog meetings today he just enjoys looking his best at all times. 12/10 for dangerously dapper doggo https://t.co/YSI00BzTBZ,12.0,Yogi,20719,3768802,3099,https://pbs.twimg.com/media/DEUtQbzW0AUTv_o.jpg,German_shepherd,0.707046,True,doggo,0.08222772116975102,0.5497502920026045
39,883838122936631299,2017-07-09 00:00:04,This is Noah. He can't believe someone made this mess. Got the vacuum out for you though. Offered to help clean pup. 12/10 super good boy https://t.co/V85xujjDDY,12.0,Noah,22269,3768801,3559,https://pbs.twimg.com/media/DEQGFgAXUAAEvfi.jpg,Doberman,0.610946,True,,0.09443321629345779,0.5908775761840437
40,883482846933004288,2017-07-08 00:28:19,"This is Bella. She hopes her smile made you smile. If not, she is also offering you her favorite monkey. 13.5/10 https://t.co/qjrljjt948",13.5,Bella,46741,3768801,10336,https://pbs.twimg.com/media/DELC9dZXUAADqUk.jpg,golden_retriever,0.943082,True,,0.2742516784515818,1.2402087560473478
41,883360690899218434,2017-07-07 16:22:55,Meet Grizzwald. He may be the floofiest floofer I ever did see. Lost eyes saving a schoolbus from a volcano erpuption. 13/10 heroic as h*ck https://t.co/rf661IFEYP,13.0,Grizzwald,22932,3768801,3802,https://pbs.twimg.com/media/DEJT3FeXoAAtwUy.jpg,chow,0.987997,True,floofer,0.10088089023538255,0.6084693779268261
42,883117836046086144,2017-07-07 00:17:54,"Please only send dogs. We don't rate mechanics, no matter how h*ckin good. Thank you... 13/10 would sneak a pat https://t.co/Se5fZ9wp5E",13.0,,37810,3768801,6900,https://pbs.twimg.com/media/DEF2-_hXoAAs62q.jpg,golden_retriever,0.949562,True,,0.18308209958551805,1.0032368384533967
43,882992080364220416,2017-07-06 15:58:11,This is Rusty. He wasn't ready for the first pic. Clearly puppared for the second. 13/10 confirmed great boy https://t.co/tyER0KpdXj,13.0,Rusty,24358,3768801,4086,https://pbs.twimg.com/media/DEEEnIqXYAAiJh_.jpg,,0.466778,True,,0.108416443319772,0.6463063451744998
44,882762694511734784,2017-07-06 00:46:41,This is Gus. He's quite the cheeky pupper. Already perfected the disinterested wink. 12/10 would let steal my girl https://t.co/D43I96SlVu,12.0,Gus,28810,3768802,5086,https://pbs.twimg.com/media/DEAz_HHXsAA-p_z.jpg,Labrador_retriever,0.85005,True,pupper,0.13495004513370562,0.7644338970314705
45,882627270321602560,2017-07-05 15:48:34,This is Stanley. He has his first swim lesson today. Doggle straps adjusted. Ready to go. 13/10 Phelps is nervous (IG: stanleythe_corgi) https://t.co/Nx52PGwH94,13.0,Stanley,28327,3768802,6303,https://pbs.twimg.com/media/DD-40X3WAAAJPU5.jpg,Pembroke,0.542982,True,,0.16724147355048102,0.7516181534609672
46,882268110199369728,2017-07-04 16:01:23,This is Alfy. You're witnessing his first watermelon experience. I think it was a success. 13/10 happy 4th Alfy ðŸ‡ºðŸ‡¸ https://t.co/fYP5RlutfA,13.0,Alfy,45745,3768803,12013,https://pbs.twimg.com/media/DD5yKdPW0AArzX8.jpg,golden_retriever,0.762211,True,,0.3187484195910479,1.2137806088564458
47,882045870035918850,2017-07-04 01:18:17,"This is Koko. Her owner, inspired by Barney, recently built a cart for her to use during walks if she got tired. 13/10 rest easy Koko https://t.co/zeDpnsKX7w",13.0,Koko,29843,3768806,5162,https://pbs.twimg.com/media/DD2oCl2WAAEI_4a.jpg,,0.949591,False,,0.1369664556891493,0.7918422970033481
48,881906580714921986,2017-07-03 16:04:48,This is Rey. He's a Benebop Cumberfloof. 12/10 dangerously pettable https://t.co/503CgWbhxQ,12.0,Rey,24708,3768807,3516,https://pbs.twimg.com/media/DD0pWm9XcAAeSBL.jpg,,0.291539,True,,0.09329212135299048,0.655592074627329
49,881666595344535552,2017-07-03 00:11:11,This is Gary. He couldn't miss this puppertunity for a selfie. Flawless focusing skills. 13/10 would boop intensely https://t.co/7CSWCl8I6s,13.0,Gary,51390,3768807,11026,https://pbs.twimg.com/media/DDxPFwbWAAEbVVR.jpg,Saluki,0.529012,True,,0.2925594226501914,1.3635614665330436
50,881536004380872706,2017-07-02 15:32:16,"Here is a pupper approaching maximum borkdrive. Zooming at never before seen speeds. 14/10 paw-inspiring af 
(IG: puffie_the_chow) https://t.co/ghXBIIeQZF",14.0,,50326,3768807,16564,https://pbs.twimg.com/ext_tw_video_thumb/881535971568889856/pu/img/9bawiZ--8FKywTkz.jpg,,0.281463,True,pupper,0.43950247385976515,1.3353297210496584
51,881268444196462592,2017-07-01 21:49:04,Meet Elliot. He's a Canadian Forrest Pup. Unusual number of antlers for a dog. Sneaky tongue slip to celebrate #Canada150. 12/10 would pet https://t.co/cgwJwowTMC,12.0,Elliot,23462,3768807,5328,https://pbs.twimg.com/media/DDrk-f9WAAI-WQv.jpg,,0.473303,False,,0.14137099617995827,0.6225312147849439
52,880935762899988482,2017-06-30 23:47:07,This is Louis. He's crossing. It's a big deal. 13/10 h*ckin breathtaking https://t.co/D0wb1GlKAt,13.0,Louis,17288,3768807,2871,https://pbs.twimg.com/media/DDm2Z5aXUAEDS2u.jpg,,0.251801,False,,0.07617795233345726,0.458712796914249
53,880872448815771648,2017-06-30 19:35:32,Ugh not again. We only rate dogs. Please don't send in well-dressed  floppy-tongued street penguins. Dogs only please. Thank you... 12/10 https://t.co/WiAMbTkDPf,12.0,,21667,3768807,3957,https://pbs.twimg.com/media/DDl8zzJW0AAisCJ.jpg,Pembroke,0.791416,True,,0.10499343691518298,0.5749034110794211
54,880465832366813184,2017-06-29 16:39:47,This is Bella. She had her first beach experience this morning. Complete success. 12/10 would perform a sandy boop https://t.co/4VsFysDmiw,12.0,Bella,28997,3768807,6500,https://pbs.twimg.com/media/DDgK-J4XUAIEV9W.jpg,golden_retriever,0.913255,True,,0.17246836996428844,0.7693946652083803
55,880221127280381952,2017-06-29 00:27:25,Meet Jesse. He's a Fetty Woof. His tongue ejects without warning. A true bleptomaniac. 12/10 would snug well https://t.co/fUod0tVmvK,12.0,Jesse,27561,3768807,4398,https://pbs.twimg.com/media/DDcscbXU0AIfDzs.jpg,,0.238525,True,,0.11669475247737546,0.7312924222439621
56,880095782870896641,2017-06-28 16:09:20,Please don't send in photos without dogs in them. We're not @porch_rates. Insubordinate and churlish. Pretty good porch tho 11/10 https://t.co/HauE8M3Bu4,11.0,,28085,3768807,4506,https://pbs.twimg.com/media/DDa6ckbXgAAM1vV.jpg,,0.120298,True,,0.11956038077832057,0.7451960262226216
57,879862464715927552,2017-06-28 00:42:13,This is Romeo. He would like to do an entrance. Requesting your immediate assistance. 13/10 https://t.co/Qh5aEkRQm9,13.0,Romeo,22609,3768807,3615,https://pbs.twimg.com/media/DDXmPrbWAAEKMvy.jpg,basset,0.813507,True,,0.0959189472955235,0.5998980579265534
58,879492040517615616,2017-06-27 00:10:17,This is Bailey. He thinks you should measure ear length for signs of growth instead. 12/10 https://t.co/IxM9IMKQq8,12.0,Bailey,23778,3768807,3300,https://pbs.twimg.com/media/DDSVWMvXsAEgmMK.jpg,,0.479896,True,,0.08756086475110028,0.6309158309247462
59,879415818425184262,2017-06-26 19:07:24,This is Duddles. He did an attempt. 13/10 someone help him (vid by Georgia Felici) https://t.co/UDT7ZkcTgY,13.0,Duddles,107834,3768807,45655,https://pbs.twimg.com/ext_tw_video_thumb/879415784908390401/pu/img/cX7XI1TnUsseGET5.jpg,,0.383404,True,,1.2113912970337828,2.861223724112166
60,879376492567855104,2017-06-26 16:31:08,This is Jack AKA Stephen Furry. You're not scoring on him. Unless he slips down the slide. 12/10 would happily get blocked by https://t.co/0gOi601EAa,12.0,Jack,17061,3768807,3239,https://pbs.twimg.com/media/DDQsQGFV0AAw6u9.jpg,,0.663601,False,,0.08594231543297388,0.45268967076318845
61,879050749262655488,2017-06-25 18:56:45,This is Steven. He has trouble relating to other dogs. Quite shy. Neck longer than average. Tropical probably. 11/10 would still pet https://t.co/2mJCDEJWdD,11.0,Steven,22978,3768807,4890,https://pbs.twimg.com/media/DDMD_phXoAQ1qf0.jpg,,0.311861,False,,0.12974928140390313,0.6096889546214491
62,879008229531029506,2017-06-25 16:07:47,This is Beau. That is Beau's balloon. He takes it everywhere. 13/10 would protect at all costs https://t.co/YDtpCjIPKN,13.0,Beau,19265,3768807,2793,https://pbs.twimg.com/media/DDLdUrqXYAMOVzY.jpg,vizsla,0.960513,True,,0.07410833189388578,0.5111697149787718
63,878776093423087618,2017-06-25 00:45:22,This is Snoopy. He's a proud #PrideMonthPuppo. Impeccable handwriting for not having thumbs. 13/10 would love back #PrideMonth https://t.co/lNZwgNO4gS,13.0,Snoopy,19708,3768807,4282,https://pbs.twimg.com/media/DDIKMXzW0AEibje.jpg,Italian_greyhound,0.734684,True,puppo,0.1136168554133974,0.5229240977317225
64,878281511006478336,2017-06-23 16:00:04,"Meet Shadow. In an attempt to reach maximum zooming borkdrive, he tore his ACL. Still 13/10 tho. Help him out below

https://t.co/245xJJElsY https://t.co/lUiQH219v6",13.0,Shadow,7890,3768807,1338,https://pbs.twimg.com/media/DDBIX9QVYAAohGa.jpg,,0.32042,True,,0.03550195061726429,0.20935006754126706
65,878057613040115712,2017-06-23 01:10:23,This is Emmy. She was adopted today. Massive round of pupplause for Emmy and her new family. 14/10 for all involved https://t.co/cwtWnHMVpe,14.0,Emmy,42743,3768807,7118,https://pbs.twimg.com/media/DC98vABUIAA97pz.jpg,French_bulldog,0.839097,True,,0.1888661319085854,1.1341254672897816
66,877736472329191424,2017-06-22 03:54:17,This is Aja. She was just told she's a good dog. Suspicions confirmed. 13/10 would tell again https://t.co/lsPyyAiF1r,13.0,Aja,81450,3768930,19908,https://pbs.twimg.com/media/DC5YqoQW0AArOLH.jpg,Chesapeake_Bay_retriever,0.8379559999999999,True,,0.5282135778589679,2.1610908135730833
68,877556246731214848,2017-06-21 15:58:08,This is Penny. She's both pupset and fired pup. Not pleased w your barbaric attempts at cleanliness. 12/10 would enjoy more shampoo options https://t.co/OYdDlfOGXP,12.0,Penny,23188,3768809,3973,https://pbs.twimg.com/media/DC20wEcW0AAf59m.jpg,basset,0.995368,True,,0.105417918498921,0.6152606831495042
69,877316821321428993,2017-06-21 00:06:44,"Meet Dante. At first he wasn't a fan of his new raincoat, then he saw his reflection. H*ckin handsome. 13/10 for water resistant good boy https://t.co/SHRTIo5pxc",13.0,Dante,27835,3768809,5377,https://pbs.twimg.com/media/DCza_vtXkAQXGpC.jpg,Saluki,0.5099670000000001,True,,0.14267106664200813,0.738562235443611
70,877201837425926144,2017-06-20 16:29:50,This is Nelly. He graduated with his dogtorate today. Wants to know if you're proud of him. 12/10 would give congratulatory boop https://t.co/4g4cfj3P4Y,12.0,Nelly,27661,3768809,5829,https://pbs.twimg.com/media/DCxyahJWsAAddSC.jpg,Pembroke,0.93112,True,,0.1546642453889279,0.7339453922976729
71,876838120628539392,2017-06-19 16:24:33,This is Ginger. She's having a ruff Monday. Too many pupper things going on. H*ckin exhausting. 12/10 would snug passionately https://t.co/j211oCDRs6,12.0,Ginger,21069,3768809,3493,https://pbs.twimg.com/media/DCsnnZsVwAEfkyi.jpg,bloodhound,0.575751,True,pupper,0.09268179947564337,0.5590360243779932
72,876484053909872640,2017-06-18 16:57:37,This is Benedict. He wants to thank you for this delightful urban walk. Hopes you know he loves you. 13/10 super duper good boy https://t.co/26BXueUgbs,13.0,Benedict,19086,3768809,2499,https://pbs.twimg.com/media/DCnll_dUQAAkBdG.jpg,golden_retriever,0.874566,True,,0.06630741966493925,0.5064199326630774
73,876120275196170240,2017-06-17 16:52:05,"Meet Venti, a seemingly caffeinated puppoccino. She was just informed the weekend would include walks, pats and scritches. 13/10 much excite https://t.co/ejExJFq3ek",13.0,Venti,28392,3768809,4872,https://pbs.twimg.com/media/DCiavj_UwAAcXep.jpg,Bernese_mountain_dog,0.534327,True,,0.1292716080862681,0.7533414402268728
74,875747767867523072,2017-06-16 16:11:53,"This is Goose. He's a womanizer. Cheeky as h*ck, but also deep. Tongue slip game on another level. 13/10 will steal your girl https://t.co/V2WlACRJCN",13.0,Goose,25710,3768809,4478,https://pbs.twimg.com/media/DCdH8YpUQAAiEbL.jpg,Labrador_retriever,0.799551,True,,0.11881737705466103,0.6821783751843089
75,875144289856114688,2017-06-15 00:13:52,Meet Nugget and Hank. Nugget took Hank's bone. Hank is wondering if you would please return it to him. Both 13/10 would not intervene https://t.co/ogith9ejNj,13.0,Nugget,22346,3768810,5114,https://pbs.twimg.com/ext_tw_video_thumb/875144175078957056/pu/img/BRi_l7vUdpb93Knf.jpg,,0.245048,True,,0.13569269875637138,0.59291925037346
76,875021211251597312,2017-06-14 16:04:48,Guys please stop sending pictures without any dogs in th- oh never mind hello excuse me sir. 12/10 stealthy as h*ck https://t.co/brCQoqc8AW,12.0,,25948,3768811,4895,https://pbs.twimg.com/media/DCSzF3NVoAAPzT4.jpg,West_Highland_white_terrier,0.7143189999999999,True,,0.12988181153154138,0.6884930021696498
77,874680097055178752,2017-06-13 17:29:20,Meet Cash. He hath acquired a stick. A very good stick tbh. 12/10 would pat head approvingly https://t.co/lZhtizkURD,12.0,Cash,28371,3768811,4825,https://pbs.twimg.com/media/DCN85nGUwAAzG_q.jpg,Labrador_retriever,0.836052,True,,0.12802446182628952,0.7527838355385823
78,874296783580663808,2017-06-12 16:06:11,This is Jed. He may be the fanciest pupper in the game right now. Knows it too. 13/10 would sign modeling contract https://t.co/0YplNnSMEm,13.0,Jed,26563,3768812,4284,https://pbs.twimg.com/media/DCIgSR0XgAANEOY.jpg,,0.437216,True,pupper,0.11366977180076905,0.7048109589971587
79,874057562936811520,2017-06-12 00:15:36,"I can't believe this keeps happening. This, is a birb taking a bath. We only rate dogs. Please only send dogs. Thank you... 12/10 https://t.co/pwY9PQhtP2",12.0,,23061,3768812,4107,https://pbs.twimg.com/media/DCFGtdoXkAEsqIw.jpg,flat-coated_retriever,0.8321770000000001,True,,0.10897333164933672,0.6118904312552602
